Titel,Link,Genre,Jahr,Land,Aufnahmeleitung,Bauausführung,Bauten,Choreografie,Darsteller,Dialoge,Dramaturgie,Dreharbeiten,Drehbuch,Erstverleih,Garderobe,Herstellungsleitung,Idee,Kamera,Kamera-Assistenz,Kostüme,KünstlerischeOberleitung,Liedtexte,Maske,Musik,Musik-Ausführung,MusikalischeLeitung,MusikalischeVorlage,Produktionsfirma,Produktionsleitung,Produzent,Regie,Regie-Assistenz,Requisite,Schnitt,Script,Standfotos,Supervision,Ton,Vorlage,im Auftrag von,Länge,Format,Bild/Ton,Aufführung,Prüfung/Zensur
"25 Jahre ""Chemische""",https://www.filmportal.de/film/25-jahre-chemische_377dd4d7cfa5482b9bc3ff91de17d9d1,Spielfilm,1934,Deutschland,,,,,,,,,,,,,,,,,,,,,,,,,,,,,,,,,,,,,,,,,
Abenteuer eines jungen Herrn in Polen,https://www.filmportal.de/film/abenteuer-eines-jungen-herrn-in-polen_1cc4c6114ccf478780a752d71d4f7e2a,Spielfilm,1934,Deutschland,,,"Gustav A. Knauer, Alexander Mügge",,"Gustav Fröhlichvon Keller, Leutnant der K.u.K. österr. Armee, Olga Tschechowa: Gräfin Lubenska, Maria Andergast: Vera, Erika Streithorst: Claire, Otto Tressler: Graf Lubinski, Ernst Stahl-Nachbaur: Oberst von Keller der k.u.k. österr. Armee, Harry Hardt: Stroganoff, Rittmeister, Armin Schweizer: Hartlieb, Hans Richter: Fritz, Walther Jung: General der russischen Armee, Ernst Dumcke: Oberst der rusischen Armee, Friedrich GnaßGefangener, Erich Bartels, Angelo Ferrari, Bernhard Goetzke, Heinz B. Klockow, Anton Krilla, Kurt Mikulski, Rio Nobile, Walter Steinweg",,,,"Hans Martin Cremer, Tr. Georg Wittuhn",,,,,"Reimar Kuntze, Albert Benitz",,,,,,"Eduard Künneke, Franz Marszalek",,,,Itala-Film Gmb: H (Berlin),Alfred Greven,Alberto Giacalone,Gustav Fröhlich,Rudolf van der Noss,,Carl Otto Bartning,,Karl Ewald,,,,,,,,,
Abenteuer im Südexpreß,https://www.filmportal.de/film/abenteuer-im-suedexpress_43dc5ddf6f0d4b169399a2bdebbc47f4,Spielfilm,1934,Deutschland,,,,,"Charlotte Susa: Lisa von Hellwitz, Karl Ludwig Diehl: Hans Lenzfeld, Ralph Arthur Roberts: Prinz Tarnoff, Richard Romanowsky: Prof. Eberhard Degenfeld, Paul Heidemann: Schnäbeli,, Otto Kronburger: Diener des Prinzen, Hans Richter: Max, Baby Gray: Sängerin, Annemarie Schwindt, Hans Stiebner, Michael von Newlinski, Wolfgang von Schwindt, Charly Berger, Elli Blank, Walter Dysing, Angelo Ferrari, Trude Haefelin, Carola Höhn, Fred Immler, Maria Loja",,,,Ernst Marischka,,,,,Carl Drews,,,Robert Neppach,,,Robert Stolz,,Rudolf Perak,,"R. N.-Filmproduktion Gmb: H, Robert Neppach (Berlin)",Adolf Essek,,Erich Waschneck,,,Friedel Buckow,,,,Erich Lange,,,,"35mm, 1:1,37","s/w, Tobis-Klangfilm",,
Abschiedswalzer. Zwei Frauen um Chopin,https://www.filmportal.de/film/abschiedswalzer-zwei-frauen-um-chopin_01a57334585441b7af35c080454aa79f,Spielfilm,1934,Deutschland,,,"Emil Hasler, Artur Schwarz",,"Wolfgang Liebeneiner: Frédéric Chopin, Richard Romanowsky: Professor Elsner, Hanna Waag: Constantia Gladkowska, Julia Serda: Frau Gladkowska, ihre Mutter, Sybille Schmitz: George Sand, Hans Schlenck: Franz Liszt, Gustav Waldau: Friedrich Kalkbrenner, Paul Henckels: Ignaz Pleyel, Albert Hörrmann: Alfred de Musset, Erna Morena: Herzogin von Orléans, Margarethe Schön: Frau Mercier, Herbert Dirmoser: Titus, Fritz Odemar: Grabowsky, Kaufmann, Walter Gross: Kellner, Veit Harlan, Maria Hofen, Karl Morvilius, Claire Reigbert, Josef Reithofer, Michael von Newlinski, Hans Schulz, Otto Stoeckel",,,,Ernst Marischka,,"Franz Lübeck, Helene Hübele, Hans Kothe",,,Werner Brandes,,,,Ernst Marischka,"Oskar Georgi, Willi Grabow",Alois Melichar,,Alois Melichar,Frédéric Chopin,Boston-Films Company mb: H (Berlin),Eduard Kubat,Fritz Fromm,Géza von Bolváry,Walther von Ostmann,"Eduard Brenner, Heinz Hegel",Hermann Haller,,Rudolf Brix,,Erich Lange,Frédéric Chopin,,,,,,
Achtung! Wer kennt diese Frau?,https://www.filmportal.de/film/achtung-wer-kennt-diese-frau_f44d87a241514ad3be316561edf51bc1,Spielfilm,1934,Deutschland,,,Max Seefelder,,"Helmuth Renar: Graf Geza von Teröcky, Hilde von Stolz: Komtesse Ilona von Teröcky, Max Weydner: Karol Meszaros, Schloßverwalter, Emil Höfer: Stephan Kovazs, Schloßkastellan, Helma Rückert: Marischka, seine Frau, Mathias Wieman: Artur von Vabro, Werner Fuetterer: Walter von Molnar, Forstassistent, Otto Wernicke: Thomas Burger, Kurt Holm: Lajos, Kammerdiener, Friedrich GnaßCarlo Fiori, Hanns-Fritz Gerhard, Walter Holten",,,,"Joseph Dalmann, Joe Stöckel",,"Hermann Dor, Dorothea Saumweber",,,Franz Koch,Josef Illig,,,,Heinrich Beckmann,,,,,Bavaria Film AG (München-Geiselgasteig),Franz Seitz Sr.,,Franz Seitz Sr.,,,Max Michel,,Rudolf Reißner,,Karl-Albert Keller,,,,,,,
Alles hört auf mein Kommando,https://www.filmportal.de/film/alles-hoert-auf-mein-kommando_5b5b77ad53bd4c76b762b16b88e43c8f,Spielfilm,1934,Deutschland,"Heinz Landsmann, Heinz Sander",,"Gustav A. Knauer, Alexander Mügge",Heinz Lingen,"Marianne Hoppe: Hella Bergson, Wolfgang Liebeneiner: Erich Neuber, Adele Sandrock: Theaterdirektorin Pauline Neuber, Georg Alexander: Zeitungsverleger Peter Bergson, Hedda Björnson: Betty Tompson, Henry Lorenzen: Bobby Merker, Aulikki Rautavaara: Liane Lenz, Otto Albrecht: Georg Horst, Gertrud Wolle: Frau Piesemeier, Wilhelm Bendow: Herr Balke, Emmy Wyda: Frau Balke, Hans Hermann SchaufußHerr Willig, Heinz Berghaus: Herr Sonntag, Alfred Stein: Herr Kaluweit, Wolfgang von Schwindt: Sänger, Gustav Püttjer: Kellner, Eduard Bornträger: Pianist, Hansi Dege, Josef Eschenbrücher, Erika Grammon, Karl Harbacher, Inge Kadon, Louise Morland, Kurt Max Richter",,,,"Walter F. Fichelscher, Georg Zoch",,,,Ernst Degener,Ewald Daub,,,,,,Walter Meißner,,Otto Dobrindt,,ABC-Film Gmb: H (Berlin),Martin Pichert,"Walter von Ercert, Kurt Peters",Georg Zoch,,,Lothar Buhle,,,,Martin Müller,,,"8 Akte, 2423 m, 88 min","35mm, 1:1,37","s/w, Tobis-Klangfilm",,"Zensur (DE): 17.12.1934, B.38118, Jugendfrei"
Alte Kameraden,https://www.filmportal.de/film/alte-kameraden_ba05b5c4b9224c78a7fccf3b4159bd3c,Spielfilm,1934,Deutschland,,,"Walter Reimann, Bernhard Schwidewski",,"Ralph Arthur Roberts: Freiherr von Achim, Hans Adalbert Schlettow: Wilhelm Markgraf, Fita Benkhoff: Liselotte Klarerdag, Eduard Wesener: Henner Markgraf, Charlott Daudert: Maruschka, Leopold von Ledebur: Schmitt, Paul Beckers: Andreas Schlagiatweit, Paul Henckels: Johann Röttgen, Vilma Bekendorf: Else, Ida Perry: Frau von Utenbruch, Harry Gondi: Egon Osterheld, Walter Gross: Otto Giesenbrecht, Hansi Dege: Franziska, Ernst Behmer: Steuerbeamter",,,,Willy Achsel,,,,,Georg Bruckbauer,,,,,,Hans Carste,,Lewis Ruth,,Aco-Film Gmb: H (Berlin),,,Fred Sauer,,,René Métain,,,,Bruno Suckau,Rudolf Herzog (Roman),,,"35mm, 1:1,37","s/w, Tobis-Klangfilm",,
Das alte Recht,https://www.filmportal.de/film/das-alte-recht_e42476c3c53f461fb1a60339083a7ddc,Spielfilm,1934,Deutschland,,,Franz Schroedter,,"Edith Linn: Resl Waldbaur, Bernhard Goetzke: Johann Ruseler, Bauer, Hans Kettler: Georg, sein Sohn, Fritz Hoopts: Kapitän Freese, Hans Rastede: Tjark, sein Sohn, Agnes Diers: Gesine, die oldenburgische Großbauerntochter",,,,"Igo Martin-Andersen, Armin Petersen",,,,,Georg Krause,,,,,,Wolfgang Zeller,,,,Andersen-Film-Produktion (Berlin),,Igo Martin-Andersen,Igo Martin-Andersen,,,"Igo Martin-Andersen, Franz Schröder",,Ewald Sudrow,,Hans Rütten,,,,,,,
L'Amour en cage,https://www.filmportal.de/film/lamour-en-cage_243edb0d789749918851b68d633d7dc9,Spielfilm,1934,Deutschland/Frankreich,,,Benno von Arent,,"Anny Ondrabaronne de Réze / Anny, René Lefèvre: Charles, André Berleymaître Poincinet, Georges Saillardcommissaire de police, Raymond Rognonidirecteur de la prison, Jane Lugangardienne de prison, Roger Legrispilote, Paul Forgetmaître d'hôtel, Pierre Lugan: Ernest",Jacques Natanson,,,"Peter Ort, Hans H. Zerlett, Henry Kosterlitz",,,,,"Otto Heller, Otto Martini",,,,Jean Nohain,,"Leo Leux (Lied ""Kleines Fäulein"")",,Leo Leux,,"Ondra-Lamac-Film Gmb: H (Berlin), Sol Film S.I.C. (Paris)",Robert Leistenschneider,"Anny Ondra, Carl Lamač, Arthur Hohenberg","Jean de Limur, Carl Lamač",Michel Boudet,,Ella Ensink,,,,Friedrich Wilhelm Dustmann,,,80 min,"35mm, 1:1.33","s/w, Tobis-Klangfilm",,
Annette im Paradies,https://www.filmportal.de/film/annette-im-paradies_444fc3988192490a95c528cec5de05d3,Spielfilm,1934,Deutschland/Tschechoslowakei,,,Stepán Kopecký,,"Ursula Grabley: Annette Karstens, Hans Söhnker: Hans Siebert, Filialleiter, Ida Wüst: Tante Olga, Max Gülstorff: Direktor Bertuch, Oscar Sabo: Papa Stelzke, Geschäftsportier, Jessie Vihrog: Trude, seine Tochter, Hans Joachim SchaufußMaxe",,,,"Georg C. Klaren, Friedrich Walther",,,,,Otto Heller,,,,"Günther Schwenn, Peter Schaeffers, Charles Amberg",,Will Meisel,,Fritz Domina,,"Georg Witt-Film Gmb: H (Berlin), Wolfram-Film, Ernst Kobosil (Prag + Aussig)",,"Georg Witt, Ernst Kobosil",Max Obal,,,Munni Obal,,,,Bedřich Poledník,,,,,,,
Aufforderung zum Tanz,https://www.filmportal.de/film/aufforderung-zum-tanz_aab81d141967414ca3633843d06f8494,Spielfilm,1934,Deutschland,,,,,,,,,Hans Martin Cremer,,,,,Ewald Daub,,,,Edith Hamann,,,,"Franz Grothe, Kurt Stiebitz",Carl Maria Weber (Kompositionen),,,,Rudolf van der Noss,,,,,,,,Carl Maria Weber (Kompositionen),,,,,,
"Badinga, der König der Gorillas",https://www.filmportal.de/film/badinga-der-koenig-der-gorillas_3359b0302d63450e9d6a49a02fea0cac,Spielfilm,1934,Deutschland,,,,,,,,,"Hermann Freyberg, Arnold Fanck",,,,,"Kurt Neubert, Werner Hundhausen",,,,,,Hermann Windt (vorgesehen),,,,,,,Hermann Freyberg,,,,,,,,,,,"35mm, 1:1.33",,,
Die Bande vom Hoheneck,https://www.filmportal.de/film/die-bande-vom-hoheneck_8858718b639b4297821fcc32e2ce0cd7,Spielfilm,1934,Deutschland,,,,,"Wolfgang Staudte: Wulff, Anne-Marie Braun: Hanni, Achim Schmidt: Hannes, Adolf Fischer: Frutz Seifert, Erwin Nic: Karl Krause",,,,Hans F. Wilhelm,,,,,Werner Brandes,,,,,,Hans Ailbout,,,,Czerny-Produktion Gmb: H (Berlin),,Ludwig Czerny (Gesamtleitung),Hans F. Wilhelm,,,Heinz Haber,,,,"Carlheinz Becker, Emil Specht",,,,,,,
Bei der blonden Kathrein,https://www.filmportal.de/film/bei-der-blonden-kathrein_55182f6905064720bf94c25a1edd9cb9,Spielfilm,1934,Deutschland,,,Max Seefelder,,"Liane Haid: Kathrein Hohenadel, Wirtin zur ""Goldenen Gans"", Thea Aichbichler: Minna Fromm, ihre Tante, Fred Hennings: Stefan Birkmeier, Kellermeister in der ""Goldenen Gans"", Joe Stöckel: Valentin Ruhland, genannt Krambambuli, Apotheker, Margarete Kupfer: Konstanze Ruhland, seine Frau, Rolf von Goth: Leopold Ruhland, Korpsstudent, ihr Sohn, Philipp Weichand: Knöpflein, Korpsdiener, Gustl Stark-Gstettenbaur: Kellerjunge in der ""Goldenen Gans"", Walter Lantzsch: Professor, Josef Eichheim: Notar",,,,"Joseph Dalmann, Joe Stöckel",,"Hermann Dor, Dorothea Saumweber",,,Franz Koch,Josef Illig,,,Peter Kringel,Heinrich Beckmann,Leo Leux,,,,Bavaria Film AG (München-Geiselgasteig),Franz Seitz Sr.,,Franz Seitz Sr.,,,Ella Ensink,,Rudolf Reißner,,Karl-Albert Keller,,,"2309 m (2312 m vor Zensur), 84 min","35mm, 1:1.33","s/w, Tobis-Klangfilm",,
Die beiden Seehunde,https://www.filmportal.de/film/die-beiden-seehunde_d6ebf2d7b9fb4d41acfee0d5dacbd967,Spielfilm,1934,Deutschland,Gustav Lorenz,,"Otto Moldenhauer, Kurt Dürnhöfer",Egon Molkow,"Weiß-Ferdl: Kurfürst Christian XVII. / Dienstmann Anton Heßdörfer, Fita Benkhoff: Thekla Heßdörfer, Baby Gray: Tochter Käte Heßdörfer, Harry Gondi: Erbprinz Johannes, Walter Steinbeck: Hofmarschall Graf Berka, Hadrian Maria Netto: Intendant Baron Presch, Franz Stein: Finanzminister Dr. Spärlich, Georgia Lind: Primaballerina Eva Blancetti, Paul Westermeier: Kommerzienrat Oberauer, Else Lüders: Frau Kommerzienrat Oberauer, Franz Weber: Leibkammerdiener Hasselwander, Walter Gross: Brunneninspektor Fritz Wennig, Gerhard Bienert: Händler Friese, Wilhelm Bendow: Polizeikommissar, Albert Hörrmann: Polizeiuntersekretär, Dodo van Doeren: Frau Kleinsucher, Katja Bennefeld, Walter Lieck, Erich Fiedler, Willy Mendau, Josef Reithofer, Arthur Reppert, Beppo Seidler, Carlo Wydey",,,,Reinhold Meißner,,Marie-Luise Arndt,,,Georg Krause,Ewald Sudrow,,,Georg Hurdalek,"Friedrich Havenstein, Walter Pantzer",Walter Ulfig,,Walter Ulfig,,Euphono-Film Gmb: H (Berlin),Franz Vogel,Franz Vogel,Fred Sauer,Wilhelm Schulze-Breiden,Otto Krüerke,Erich Palme,,Reinhold Draber,,Erich Lange,"Carl Rössler (Bühnenstück ""Die beiden Seehunde"")",,,"35mm, 1:1,37","s/w, Tobis-Klangfilm",,
Besuch am Abend,https://www.filmportal.de/film/besuch-am-abend_5c723de2629d4c0794358e7fbfee39d5,Spielfilm,1934,Deutschland,,,"Gustav A. Knauer, Alexander Mügge",,"Liane Haid: Lydia, Tänzerin, Harald Paulsen: Bobby, ihr Tanzpartner und Chansonnier, Paul Hörbiger: Karl Maria Fernebeck, Prokurist, Jakob Tiedtke: Alois Berger, Firmeninhaber, Elfriede Jerra: Sabine, seine Tochter, Erika Glässner: Frau Lukesch, Fernebecks Hauhälterin, Carl Günther: Bruno, Fernebecks Freund, Gustl Stark-Gstettenbaur: Bürobote, Lieselotte Ebel: Karola, Tänzerin, Katja Bennefeld, Else Bötticher, Maja Feist, Walter Gross, Liselotte Hessler, Henriette Steinmann, Hella Tornegg, Elsa Wagner, Josef Zampa",,,,"Bobby E. Lüthge, Georg C. Klaren",,,,,Robert Baberske,,,,"Rudolf Perak, Charles Amberg",,Willy Engel-Berger,,Rudolf Perak,,Patria-Filmproduktions- und Vertriebs Gmb: H (Berlin),Ernst Garden,Hans Geishauer,Georg Jacoby,,Max Klar,Alice Ludwig,,Fritz Vopel,,Carlheinz Becker,,,,,,,
Blutsbrüder. Bosnische Symphonie,https://www.filmportal.de/film/blutsbrueder-bosnische-symphonie_d934bd3a52854f67a32d1267f63d8658,Spielfilm,1934,Deutschland,,,,,"Brigitte Horney, Carl Esmond, Attila Hörbiger, Willi Schur, Friedrich Gnaß, Sophie Otto, Anna von Palen, Erna Heinrich, Josef Reithofer, Hermann Mayer-Falkow",,,,"Franz Tanzler, J. A. Hübler-Kahla",,,,,"Georg Muschner, Paul Rischke",,,,,,Willy Schmidt-Gentner,,,,,,,J. A. Hübler-Kahla,,,,,,,,,,,,,,
Le chanson de l'adieu,https://www.filmportal.de/film/le-chanson-de-ladieu_4f706a3d936c4e86bceeac82c269716c,Spielfilm,1934,Deutschland/Frankreich,,,"Emil Hasler, Artur Schwarz",,"Janine Crispin: Constantia Glodkowska, Jean Servais: Chopin, Lucienne Lemarchand: George Sand, Marcel AndréKalbrenner, Daniel Lecourtois: Liszt, Marcel Vallée: Josef Elsner, Catherine Fonteney, Erna Morena, Christiane Dor, Jean Fay, Paul Asselin, Marc Falbel, Pierre Sergeol",Jacques Natanson,,,Ernst Marischka,,"Franz Lübeck, Helene Hübele, Hans Kothe",,,Werner Brandes,,,,,"Oskar Georgi, Willi Grabow",Alois Melichar,,Alois Melichar,"Frédéric Chopin (Kompositionen), Wolfgang Amadeus Mozart (Kompositionen)","Société des Films Sonores Tobis (Paris), Boston-Films Company mb: H (Berlin)",Eduard Kubat,Fritz Fromm,"Géza von Bolváry, Albert Valentin",Walther von Ostmann,"Eduard Brenner, Heinz Hegel",,,Rudolf Brix,,Erich Lange,"Frédéric Chopin (Kompositionen), Wolfgang Amadeus Mozart (Kompositionen)",,,,,,
Charleys Tante,https://www.filmportal.de/film/charleys-tante_9f4101d6219b405e9959bdd0db4e36da,Spielfilm,1934,Deutschland,,,Franz Schroedter,,"Fritz Rasp: Lord Babberley, Paul Kemp: Fancourt Babberley, sein Sohn, genannt Babbs, Max Gülstorff: Colonel Sir Francis Chesney, Baronet, Albert Lieven: Jack, Chasneys Sohn, Student in Oxford, Erik Ode: Charley Wykeham, Student in Oxford, Paul Henckels: Stephan Spettik, Advokat, Jessie Vihrog: Amy, Spettiks Nichte, Carola Höhn: Kitty, Spettiks Nichte, Ida Wüst: Donna Lucia d'Alvadorez, Vilma Bekendorf: Ela Delahay, ihre Sekretärin, Fita Benkhoff: Mary Fin, Haushälterin bei Spettik, Fritz Odemar: Bressett, Diener bei Jack und Charley, Ernst Legal: Nelson, Gastwirt, Ernst Nessler: Aristophan, Diener bei Lord Babberley, Charlotte Berlow: Miss Bedford, Gesangslehrerin, Henry Pauly: Der Lehrling Smith, Rudolf Platte: Shipmaker, Inhaber eines Hafenbazars",,,,Robert A. Stemmle,,,,,Carl Drews,,,,,,Harald Böhmelt,,,,Minerva-Tonfilm Gmb: H (Berlin),,,Robert A. Stemmle,,,,,,,Carlheinz Becker,"Brandon Thomas (Bühnenstück ""Charley's Aunt"")",,"2503 m, 91 min","35mm, 1:1.33","s/w, Tobis-Klangfilm",,
La crise est finie,https://www.filmportal.de/film/la-crise-est-finie_118dcf4a7a1040ecb75b5d8be874d0ef,Spielfilm,1934,Deutschland,,,,,Ilse Nast,,,,"Friedrich Kohner, Max Kolpé, Jacques Constant",,,,,Eugen Schüfftan,,,,,,"Franz Wachsmann, Jean Lenoir",,,,Nero-Film AG (Berlin),,,Robert Siodmak,,,,,,,,"Kurt Siodmak (Roman), Friedrich Kohner (Roman)",Paramount France (Paris),"2112 m, 77 min","35mm, 1:1,37","s/w, Ton",,
Die Czardasfürstin,https://www.filmportal.de/film/die-czardasfuerstin_2e3e27378b9c4dc49e3516e0acc10765,Spielfilm,1934,Deutschland,Eduard Kubat,,"Robert Herlth, Walter Röhrig",,"Marta Eggerth: Sylva Varescu, Hans Söhnker: Edwin Prinz Weylersheim, Paul Hörbiger: Feri von Kerekes, Paul Kemp: Graf Boni Kancsianu, Ida Wüst: Fürstin Weylersheim, Inge List: Komtesse Stasi von Planitz, Friedrich Ulmer: Fürst Weylersheim, Hans Junkermann: Kommandeur, Edwin Jürgensen: Amerikanischer Manager, Andor Heltai: Zigeunerprimas, Ilse Fürstenberg1. Mädel vom Chantant, Marina von Ditmar2. Mädel vom Chantant, Charlott Daudert3. Mädel vom Chantant, Hedi Höpfner4. Mädel vom Chantant, Margot Höpfner5. Mädel vom Chantant, Karin Lüsebrink6. Mädel vom Chantant, Liselotte Hessler7. Mädel vom Chantant, Olga Engl: Garderobiere, Josef Karma, Toni Bonsch, Otto Sauter-Sarto, Carl Walther Meyer, Hermann Mayer-Falkow",,,,"Hans H. Zerlett, Bobby E. Lüthge, Georg Jacoby",,"Fritz Schilling, Eduard Weinert",,,Carl Hoffmann,Günther Anders,,,"Béla Jenbach, Leo Stein",Waldemar Jabs,"Emmerich Kálmán, Hans-Otto Borgmann",,"Theo Mackeben, Hans-Otto Borgmann (Orchester)",,Universum-Film AG (UFA) (Berlin) (Herstellungsgruppe Max Pfeiffer),Max Pfeiffer,,Georg Jacoby,Herbert B. Fredersdorf,"Emil Freude, Arthur Schwandt",Herbert B. Fredersdorf,,Willi Klitzke,,Carlheinz Becker,"Emmerich Kálmán (Operette), Béla Jenbach (Libretto), Leo Stein (Libretto)",,"10 Akte, 2793 m, 102 min","35mm, 1:1,37","s/w, Tobis-Klangfilm",,
Da stimmt was nicht,https://www.filmportal.de/film/da-stimmt-was-nicht_b9c63d72cbec474ca493bf40bf2e2639,Spielfilm,1934,Deutschland,,,"Erich Czerwonski, Karl Böhm",,"Viktor de Kowa: Baron Albrecht von Weiningen, Adele Sandrock: Baronin von Weiningen, seine Tante, Ralph Arthur Roberts: Kommerzienrat Winkler, Lizzi Holzschuh: Hanna, seine Tochter, Kurt Mühlhardt: Direktor Claasen, Elga Brink: Daisy seine Frau, Paul Heidemann: Anton Pieseke, Hans-Joachim Büttner: Chauffeur Müller, Charlott Daudert: Anny, Stubenmädchen, Hans Nerking: Kriminalkommissar Fürstle, Willy Schaeffers: Hotelgast, Hans Albin, Flora Berthold, Rudolf Biebrach, Ilse von Collani, Blandine Ebinger, Ruth Eweler, Charlotte Haase, Karl Harbacher, Kurt Höllger, Kurt Keller-Nebri, Michael von Newlinski, Gustav Püttjer, Dolly Raphael, Lore von Schenk, Bruno Ziener",,,,Hans H. Zerlett,,"Margarete Sucrow, Johannes Krämer",,,Bruno Mondi,Ernst W. Fiedler,,,Hans H. Zerlett,"Adolf Braun, Willi Grabow",Eduard Künneke,,Franz Marszalek,,Victor Klein-Film Gmb: H (Berlin),Martin Pichert,Viktor Klein,Hans H. Zerlett,Wolfgang Loë-Bagier,"Otto Krüerke, Ernst Thege, Ernst Wassermann",Else Baum,,Karl Lindner,,Erich Lange,,,,,,,
La dernière valse,https://www.filmportal.de/film/la-derniere-valse_42ed733aae474746bfdfb08a7234cfed,Spielfilm,1934,Deutschland/Großbritannien,,,"Emil Hasler, Robert Gys",,"Jarmila Novotnacomtesse Vera-Elisabetha Opalinsky, Jean Martinelli: Comte Dmitri, Josephine Huntley Wright: Babouchka, Armand Bernardvieux général, Gerald Barry: Prince Paul, Charlotte Lysès, Marthe Mellot, Nora Souane, Betty Huntley Wright, Robert Goupil, Paul Sheridan, Pierre Piérade, Gautier Sylla, Robert Guillon",Paul Schiller,,,Reginald Arkell,,,,,Carl Drews,,,,,,Oscar Straus (unter Verwendung eigener Kompositionen),,Paul Hühn,,"Gnom-Tonfilm Gmb: H (Berlin), Warwick Films Ltd. (London)","Hans Wolf, Hans Nerking, Jean Legrand",Jacob Brodsky,Leo Mittler,Hanns Theo Grust,,,,,,Carl Becker,,,90 min,"35mm, 1:1.33",,,
Le diable en bouteille,https://www.filmportal.de/film/le-diable-en-bouteille_1b4b45d2a58c4ea988c03a9e696953f6,Spielfilm,1934,Deutschland,,,Otto Hunte,,"Käthe von Nagy, Pierre Blanchar: Keave, Gina Manès: Rubby, Paul Azaïs: Lopaka, Gabriel Gabrio: Mounier, Roger Karlle marchand, Marguerite de Morlayela comtesse, Suzy Pierson: Bertie, la femme la chambre, Maryanne, Georges Malkine: Vikhom, Roger Legris: Tirill, Daniel Mendaille: Jerry, Bill-Bocketts: Balmez, Léon Roger-Maxime: Hein, Philippe Richard: Macco, Gaston Duboscle Comte, Henri Richardle notaire, Gaston Mauger: Collins, Raoul Marco, Barencey, André Nicolle, Henri Beaulieu, Jean Brochard, Armand Morins, Edouard Hamel, Tellas?, Albert Broquin",Serge Véber,,,"Kurt Heuser, Josef Pelz von Felinau, Liselotte Gravenstein",,,Karl Ritter,,Fritz Arno Wagner,Werner Krien,,,,,Theo Mackeben,,Theo Mackeben,,Universum-Film AG (UFA) (Berlin),,,"Heinz Hilpert, Reinhart Steinbicker",,,,,,,Erich Leistner,,Alliance Cinématographique Européenne (A.C.E.) (Paris),,,,,
Der Doppelbräutigam,https://www.filmportal.de/film/der-doppelbraeutigam_b314a2398e9e4335ab7f09a878cf57cc,Spielfilm,1934,Deutschland/Tschechoslowakei,,,Stepán Kopecký,,"Fritz Kampers: Viktor Lange / Prof. Alfred Ritter, sein Onkel, Jakob Tiedtke: Roland, Musikverleger, Lien Deyers: Eva, seine Tochter, Carsta Löck: Helene, seine Tochter, Werner Jantsch: Morrison, Alois DvorskýHauswirt, Jára Kohout: Käufer im Musikverlag",Hans Fritz Köllner,,,"Hugo Haas, Martin Frič",,,,,Václav Vích,,,,Erich Einegg,,Erich Einegg,,,,"Moldavia-Film AG (Prag), Itala-Film Gmb: H (Berlin)",,Alberto Giacalone,Martin Frič,,,Fernando Tropea,,,,Frantisek Sindelár,,,,,,,
Der Doppelgänger,https://www.filmportal.de/film/der-doppelgaenger_8841af7fa1fa40c199ccda49f6edbe9b,Spielfilm,1934,Deutschland,,,"Erich Zander, Willi Depenau",,"Camilla Horn: Jenny Miller, Georg Alexander: Harry Selsbury, Gerda Maurus: Germaine de Roche, Theo Lingen: Detektiv Superbus, Fritz Odemar: Trentner, Butler bei Harry Selsbury, Jakob Tiedtke: Mister Miller, Josef Eichheim: Raimondo Dempsi, Hans Leisner-Fischer: Bobby Selsbury, Willi Schur, Franz Weber, Michael von Newlinski, Maja Feist",,,,"Curt J. Braun, Peter Ort, Henry Kosterlitz",,"Willi Schlick, Senta Schlick",,,Hugo von Kaweczynski,Erich Großmann,,,,Alois Strasser,Leo Leux,,Leo Leux,,Ondra-Lamac-Film Gmb: H (Berlin),Helmut Schreiber,"Carl Lamač, Arthur Hohenberg",E. W. Emo,Herbert Grünewald,"Johannes Vonberg, Karl Meyer",Ella Ensink,,Josef Höfer,,Emil Specht,"Edgar Wallace (Roman ""Double Dean"")",,"2416 m, 88 min","35mm, 1:1,33","s/w, Ton",,
Dornröschen,https://www.filmportal.de/film/dornroeschen_8f12bbc417ab4aeea3a858a400d9d06e,Spielfilm,1934,Deutschland,,,,,,,,,,,,,,,,,,,,,,,,,,,,,,,,,,,,,"4 Akte, 1348 m",,,,"Zensur (DE): 29.10.1934, B.37686, Verbot"
Eine Siebzehnjährige,https://www.filmportal.de/film/eine-siebzehnjaehrige_1bd36ee45734496d88976efff247da99,Spielfilm,1934,Deutschland,,,,,Alfred Abel,,,,,,,,,,,,,,,,,,,,,,Arthur Maria Rabenalt,,,,,,,,,,"2373 m, 87 min","35mm, 1:1.33",s/w,,
Einmal eine große Dame sein,https://www.filmportal.de/film/einmal-eine-grosse-dame-sein_5992a97d6bad4c2ab2d65bf5fb0b695f,Spielfilm,1934,Deutschland,Ernst Körner,,"Hans Sohnle, Otto Erdmann",,"Käthe von Nagy: Kitty Holm, Wolf Albach-Retty: Heinz von Wolfenstein, Gretl Theimer: Ria, Werner Fuetterer: Wolf von Wolfenstein, Ida Wüst: Baronin Agathe von Wolfenstein, Gustav Waldau: Baron Adalbert von Wolfenstein, Carola Höhn: Hilde, Hans von Zedlitz: Mister Thurner, Elfriede Sander1. Student, Josef Thuis2. Student, Peter Michael3. Student, Bert Schmidt-Moris: Flugschüler, Tommy Thomas: Pfadfinder, Assy Oehm: Modenschau, Werner Finck, Hans Junkermann, Hadrian Maria Netto, Fritz Odemar, Werner Scharf, Arthur Schröder, Grethe Weiser",,,,"Josef Pelz von Felinau, Theo Halton",,"Paul Haupt, Maria Spindler, Berta Schindler",Bruno Duday,,Werner Brandes,"Karl Drömmer, Wilhelm Schmidt",,,Bruno Balz,"Emil Neumann, Wilhelm Weber, Maria Jamitzky",Franz Doelle,,Franz Doelle,,Universum-Film AG (UFA) (Berlin),Bruno Duday,,Gerhard Lamprecht,Erich Kobler,Max Linde,Erich Kobler,,Heinz Ritter,,Dr. Fritz Seidel,,,"2500 m, 91 min","35mm, 1:1.33","s/w, Tobis-Klangfilm",,
Elisabeth und der Narr,https://www.filmportal.de/film/elisabeth-und-der-narr_321ee2913c2d48ae9a08427e37b964e2,Spielfilm,1934,Deutschland,,,"Walter Reimann, Kurt Dürnhöfer",,"Fritz Alberti: Bankier Dietrich, Hertha Thiele: Elisabeth, seine Tochter, Theodor Loos: Thomas, Organist, Rudolf Klein-Rogge: Michele, Erna Morena: Die Äbtissin, Eduard Wesener: Edgar  Waldorf, Maler, Else Ehser: Die Haushälterin Hörnlein, Ilse Nast: Die Tänzerin, Oskar Höcker: Der Zirkusdirektor, Johanna Ewald: Die Zirkusdirektorin, Klaus Pohl: Der Clown August, Gerhard Dammann: Der Polizeikommisar, Karl Platen: Der Kanzleischreiber, Carl de Vogt",,,,Walter Reimann,,,,,Franz Weihmayr,,,,,Otto Wustrak,Gottfried Huppertz,,Werner Schmidt-Boelcke,,Edda-Film Gmb: H (Berlin),Curt Prickler,Otto Büsack,Thea von Harbou,,,"Fritz E. Nauch, Fritz C. Mauch",,Alexander Schmoll,,"Martin Müller, Hermann Birkhofer",,,"8 Akte, 2074 m, 76 min","35mm, 1:1,33","s/w, Tobis-Klangfilm",,"Zensur (DE): 12.12.1933, B.35235, Verbot"
Emil sucht seine Braut,https://www.filmportal.de/film/emil-sucht-seine-braut_5fe54a3910994f098485a09c34810a4b,Spielfilm,1934,Deutschland,,,,,,,,,,,,,,,,,,,,,,,,,,,,,,,,,,,,,,,,,
