Titel,Link,Genre,Jahr,Land,Aufnahmeleitung,Bauausführung,Bauten,Choreografie,Darsteller,Dialoge,Dramaturgie,Dreharbeiten,Drehbuch,Erstverleih,Garderobe,Herstellungsleitung,Idee,Kamera,Kamera-Assistenz,Kostüme,KünstlerischeOberleitung,Liedtexte,Maske,Musik,Musik-Ausführung,MusikalischeLeitung,MusikalischeVorlage,Produktionsfirma,Produktionsleitung,Produzent,Regie,Regie-Assistenz,Requisite,Schnitt,Script,Standfotos,Supervision,Ton,Vorlage,im Auftrag von,Länge,Format,Bild/Ton,Aufführung,Prüfung/Zensur
... heute Abend bei mir!,https://www.filmportal.de/film/heute-abend-bei-mir_7cf2f00d78a840aa88da60030723c1d3,Spielfilm,1934,Deutschland,Hans Tost,,Erich Czerwonski,,"Jenny Jugo: Tini, Fritz Odemar: Martin, Filialleiter, Paul Hörbiger: Baron Denhoff, Theo Lingen: Flipp, sein Diener, Lissy Arna: Manja Perescu, Enrico Benfer: Graf Mario Valoni, Flieger, Hans Albin, Vilma Bekendorf, Heinz Berghaus, Karl Elzer, Lucie Euler, Christine Grabe, Ulla von Henning, Antonie Jaeckel, Dolly Raphael",,,,,,Gustav Jäger,,,Willy Winterstein,Karl Löb,,,Richard Busch,Maria Arnold,Harald Böhmelt,,Harald Böhmelt,,Klagemann-Film Gmb: H (Berlin),Eberhard Klagemann,Eberhard Klagemann,Carl Boese,Karl Sander,"Otto Krüerke, Paul Gaeble",Hermann Haller,,Karl Lindner,,Ludwig Ruhe,,,"2504 m, 91 min","35mm, 1:1.33",s/w,,
Hohe Schule,https://www.filmportal.de/film/hohe-schule_77af4667de88461f9b66912f06e05323,Spielfilm,1934,Deutschland/Österreich,"Felix René Fohn, Rolf Eckbauer",,Julius von Borsody,,"Rudolf Forster: Kunstreiter Carlo Cavelli / Graf Werffen, Angela Salloker: Irene von Ketterer, Hans Homma: General von Ketterer, Paul Henreid: Franz von Ketterer, Camilla Gerzhofer: Frau von Ketterer, Hans Moser: Cavellis Diener Brandler, Lisl Kinast: Flori Weidner, Dinah Grace: Tänzerin, Herbert Hübner: Herr Schott, Alfred Neugebauer: Herr von Radnigg, Johannes Roth: Clown, Margarete Hruby, Mihail Xantho, Robert Horký, Cecilie Gelers, Josef Bergauer, Franz Schafheitlin",,,,Heinrich Oberländer,,,Reinhold Meißner (Gesamtleitung),,Bruno Mondi,,,,,,Willy Schmidt-Gentner,,,,ABC-Film Gmb: H (Berlin),Hans Lehmann,"Reinhold Meißner (Gesamtleitung), Walter von Ercert, Kurt Peters",Erich Engel,Roland von Rossi,,Else Baum,,,,Hermann Birkhofer,,,"10 Akte, 2468 m, 90 min","35mm, 1:1,37","s/w, Tobis-Klangfilm",,"FSK-Prüfung (DE): 18.01.1966, B 334, ab 16 Jahre / nicht feiertagsfrei"
Ich für Dich - Du für mich,https://www.filmportal.de/film/ich-fuer-dich-du-fuer-mich_6c94e4ea1fba4bdbbad1705cd8c20ecb,Spielfilm,1934,Deutschland,,,Franz Schroedter,,Carl de Vogt,,,,Hans Gustl Kernmayr,,,,,Emil Schünemann,,,,,,Hansom Milde-Meißner,,,,Froelich-Film Gmb: H (FFG) (Berlin),,,Carl Froelich,Rolf Hansen,,,,,,,,"NS-Gemeinschaft »Kraft durch Freude« (Berlin), Die Deutsche Arbeitsfront (DAF) Propaganda-Amt (Berlin)",,,,,
Ich heirate meine Frau,https://www.filmportal.de/film/ich-heirate-meine-frau_b7e4314f813e4270a7e88f78def8b331,Spielfilm,1934,Deutschland,,,"Ludwig Reiber, Karl Machus",,"Lil Dagover: Lisa Behmer, Paul Hörbiger: Hubertus Behmer, Theo Lingen: Heinrich Wittekind, Käte Haack: Luise, Mädchen bei Behmer, Fritz Odemar: Dr. Bratt, Margarete Slezak: Frau Welsin, Friedel Pisetta: Lydia, Schauspielerin, Willy Schaeffers: Dr. Hindorf, Hubert von Meyerinck: Prof. Mertens, Hadrian Maria Netto: Diener bei Mertens, Henry Lorenzen, Lucie Euler, Emmy Wyda, Gerhard Dammann, Klaus Pohl, Fritz Lafontaine, Henry Pleß, Hans Waschatko, Rudolf Biebrach",,,,"Joe Stöckel, Johannes Riemann",,,,,"Robert Baberske, Curt Courant",,,,,,Giuseppe Becce,,,,Georg Witt-Film Gmb: H (Berlin),Georg Witt,Georg Witt,Johannes Riemann,,,Fritz C. Mauch,,,,Fritz Seeger,,,"2264 m, 83 min","35mm, 1:1,33","s/w, Tobis-Klangfilm",,
Ich kenn' Dich nicht und liebe Dich,https://www.filmportal.de/film/ich-kenn-dich-nicht-und-liebe-dich_2e69b2c7bd2c4b6bac0d4e6a934eb227,Spielfilm,1934,Deutschland,,,"Emil Hasler, Artur Schwarz",,"Willi Forst: Robert Ottmar, Komponist, Max Gülstorff: Generaldirektor Claassen, Olga Limburg: Stella, seine Frau, Magda Schneider: Gloria, beider Tochter, Trude Haefelin: Katja, deren Schwester, Ernst Gronau: Erwin Rodenberg, Textdichter, Theo Lingen: Stephan, Diener, Fritz Odemar: Baron Nicki, Robert Thiem: Bobby, Angelo Ferrari: Graf Palmieri, Anton Pointner: Henri Coquard, Vilma Bekendorf: Lissy, Zofe bei Claassen, Ilja Livschakoff: Tanzkapellmeister, Kurt Hohenberger: Trompeter, Edwin Jürgensen, Richard Ludwig, Ida Perry, Ernst Rotmund, Franz W. Schröder-Schrom, Theodor Thony",,,,Walter Jerven,,Franz Hübele,,,Bruno Mondi,Ernst W. Fiedler,,,Willy Dehmel,"Willi Grabow, Oskar Georgi",Franz Grothe,Ilja Livschakoff (Orchester),Franz Grothe,,Boston-Films Company mb: H (Berlin),Robert Leistenschneider,Fritz Fromm,Géza von Bolváry,Walther von Ostmann,"Eduard Brenner, Otto Karge",Hermann Haller,,Rudolf Brix,,Erich Lange,,,,,,,
Ich sehne mich nach Dir,https://www.filmportal.de/film/ich-sehne-mich-nach-dir_591e1c95367f493bb1223f972c5e6aae,Spielfilm,1934,Deutschland,,,Erich Czerwonski,,"Louis Graveure: Sportlehrer Fritz Brockmann, Camilla Horn: Ivonne Brandt, Theo Lingen: Pelle, Adele Sandrock: Kammersängerin Katharina Brockmann, Marja Tamara: Nina Holt, Walther Suessenguth: Impressario Jean Leman, Paul Westermeier: Otto Richter, Maja Feist: Frau von Otto Richter, Albert von Kersten: Marquis, Rudolf Essek: Intendant, Ernst Legal",,,,"Hermann Fidow, Wolf Neumeister",,,,,Willy Winterstein,,Heinz A. Schulze,,,,Willy Engel-Berger,,Rudolf Perak,,Dr. V. Badal-Filmproduktion Gmb: H (Berlin),Fritz Siemund,Vahayn Badal,Johannes Riemann,,,Waldemar Gaede,,Eugen Klagemann,,Fritz Thiery,,,73 min,"1:1,37","s/w, Mono",,
Ich sing mich in Dein Herz hinein,https://www.filmportal.de/film/ich-sing-mich-in-dein-herz-hinein_51c87df6047047d584df1f0422819559,Spielfilm,1934,Deutschland,,,Otto Hunte,,"Hans von Zedlitz: Gustav Weiringen, Hans Söhnker: Hans, sein Sohn, Harald Paulsen: Peter Hell, Karikaturist, Max Gülstorff: Georg Trittau, Gutsbesitzer auf Eichhorst, Lien Deyers: Doris, seine Tochter, Adele Sandrock: Adele, seine Schwester, Fritz Odemar: James, ihr Chauffeur, Hans Adalbert Schlettow: Petzel, Schwergewichts-Boxer, Günther Ballier, Rudolf Biebrach, Rose Borgh, Carola Höhn, Inge Kadon, Rudolf Koch-Riehl, Trude Lehmann, Hermann Mayer-Falkow, Emmy Wyda",,,,"Max Wallner, Hans Vietzke",,,,,Hugo von Kaweczynski,Erich Grohmann,,,"Günther Schwenn, Peter Schaeffers","Carl Eduard Schulz, Ilse Siebert","Will Meisel, Leberecht von Guaita",,Leberecht von Guaita,,Tofa Tonfilm-Fabrikations Gmb: H (Berlin),Hans von Wolzogen,Guido Bagier,Fritz Kampers,,"Karl Meyer, Heinz Hegel",Wolfgang Becker,,Rudolf Brix,,,,,,,,,
Ihr größter Erfolg,https://www.filmportal.de/film/ihr-groesster-erfolg_078af64d768c4293b794ccf807d5e7ea,Spielfilm,1934,Deutschland,"Walter Lehmann, Max Paetz",,"Hans Sohnle, Otto Erdmann",,"Marta Eggerth: Therese Krones, Theo Lingen: Augustin Schöpser, Ballettmeister am Leopoldstädte, Aribert Mog: Franz Burgstaller, dritter Kapellmeister am Leopol, Gustav Waldau: Alois Schmatzer, Zuckerbäcker, Max Gülstorff: Marinelli, Theaterdirektor, Margarete Kupfer: Josefa Schmatzer, Genia Nikolajewa: Julie Wella, erste Soubrette am Leopoldstädter The, Maria Loja: Leopoldine Schaffer, Inhaberin der Wäscherei, Willi Schur: Kolja, Jaroffs Diener, Becker?, Irm Cherry, Dodo van Doeren, Johanna Ewald, Hersler?, Georgia Holl, Ingeborg Johannsen, Jutta Max, Gretl Morgan, Dolly Raphael, Olga Rumland, Margarete Sachse, Sakoma?, Hella Tornegg, Emmy Wyda, Pepi Zampa,  Baumann?, Bruno Eichgrün, Hugo Flink, Fred Goebel, Max Grünberg, Wilhelm Kaiser-Heyl, Walter Kunkel, Kurt Mikulski, Ernst Nessler, Hadrian Maria Netto, Michael von Newlinski, Hellmuth Passarge, Karl Platen, Gustav Püttjer, Soltani?, Edlef Schauer,  Schmidt?, Franz W. Schröder-Schrom, Armin Schweizer, Gustl Stark-Gstettenbaur, Max Wilmsen",Ernst Marischka,,,"Hanns H. Fischer, Hertha von Gebhardt",,Hans Dupke,Bruno Lopinski,,Reimar Kuntze,,,,Ernst Marischka,"Alfred Lehmann, Maria Arnold","Franz Grothe, Konradin Kreutzer (Lieder)",,Franz Grothe,,"T. K. Tonfilm-Produktion Gmb: H (Berlin), Cine-Allianz Tonfilm Gmb: H (Berlin)",,"Felix Pfitzner, Arnold Pressburger, Gregor Rabinowitsch",Johannes Meyer,Viktor Becker,"Otto Karge, Erwin Hübenthal",Alice Ludwig,,,,Carl Becker,,,,"35mm, 1:1,37","s/w, Ton",,
In Sachen Timpe,https://www.filmportal.de/film/in-sachen-timpe_e02d15ca5b1042aba302296ba6966abb,Spielfilm,1934,Deutschland,,,,,,,,,,,,,,,,,,,,,,,,,,,Carl Heinz Wolff,,,,,,,,,,,,,,
Die Insel,https://www.filmportal.de/film/die-insel_6619a79f5f0149cc97394c19d386fac6,Spielfilm,1934,Deutschland,,,"Benno von Arent, Artur Günther",,"Brigitte Helm: Karin, Willy Fritsch: Handelsattaché Raak, Otto Tressler: Botschafter, Hubert von Meyerinck1. Botschaftsrat Graf Sueelen, Georg Heinrich Schnell2. Botschaftsrat Hotten, Heinz von Cleve: Militärattaché Kapitän Rist, Günther Lüders: Presseattaché Barrick, Erich Walter: Botschaftsbeamter Kraver, Walter Franck: Minister, Herbert Gernot: Sekretär des Ministers, Franz Weber: Leiter der Handelsdelegation, Ernst Rotmund: Kommissar Ascunto, Karl Hannemann: Kriminalbeamter, Andrews Engelmann: Namenloser, Kurt Seifert: Korpulenter Mann, Hans Leibelt: Bankdirektor, Harry Hardt: Autohändler",,,,"Harald Bratt, Emil Burri",,,Karl Ritter,,Konstantin Tschet,,,,"Werner Bochmann, Erwin Lehnow",,Werner Bochmann,,Hans-Otto Borgmann,,Universum-Film AG (UFA) (Berlin),,,Hans Steinhoff,,,Willy Zeyn jun.,,,,Dr. Fritz Seidel,,,"2723 m, 100 min","35mm, 1:1,37","s/w, Ton",,
Jede Frau hat ein Geheimnis,https://www.filmportal.de/film/jede-frau-hat-ein-geheimnis_1fe52d2fc9844245b756be28bc193aa5,Spielfilm,1934,Deutschland,Hans Naundorf,,"Ludwig Reiber, Karl Machus",,"Kurt Klopsch, Karin Hardt: Annemie Kolpe, Hans Söhnker: Hans Jürgens, Ery Bos: Ingeborg von Hergenth, Hans Thimig: Dr. Bürger, Ernst Legal: Vater von Hergenth, Paul Henckels: Parfümfabrikant Kolpe, Ilse Fürstenberg, Willy Schaeffers, Hugo Fischer-Köppe, Rudolf Essek, Else Reval, Franz W. Schröder-Schrom, Erik Radolf, Antonie Jaeckel, Ernst Rückert, Maja Feist, Otto Klopsch, Max Rosenhauer",,,,"Georg C. Klaren, Friedrich Walther",,"Paul Haupt, Jenny Pieper",,,Robert Baberske,Walter Pindter,,,"Günther Schwenn, Max Obal, Peter Schaeffers","Adolf Doelle, Frieda Lehmann",Will Meisel,,,,Georg Witt-Film Gmb: H (Berlin),Georg Witt,Georg Witt,Max Obal,,"Emil Birk, Fritz Tietsch",Munni Obal,,Karl Lindner,,Fritz Seeger,,,"7 Akte, 2189 m, 80 min","35mm, 1:1,37","s/w, Tobis-Klangfilm",,
La jeune fille d'une nuit,https://www.filmportal.de/film/la-jeune-fille-dune-nuit_b1bbdf4fe5f44256b5408a8137c4d993,Spielfilm,1934,Deutschland,"Otto Lehmann, Alexander Schneider-Desnitzky",,"Erich Kettelhut, Max Mellin",,"Jeanne Cheirel: Mme Vécard, Käthe von Nagy, Paul Bernard: Marenzi fils, Simone Deguyse: Arlette, Lucien Baroux: Antoine, Adrien Le Gallo: Marenzi père, Félix Oudart: Lucien Dayle, Monette Dinay, Adele Sandrock, Émile Genevois",Raoul Ploquin,,,Reinhold Schünzel,,"Max König, Senta Schlick",Günther Stapenhorst,,Werner Brandes,Karl Drömmer,,,,"Waldemar Jabs, Wilhelm Weber",Albert Fischer,,,,Universum-Film AG (UFA) (Berlin),,,"Reinhold Schünzel, Roger Le Bon",Kurt Hoffmann,"Erich Düring, Karl Mühlberger",Willy Zeyn jun.,,Horst von Harbou,,Fritz Thiery,,Alliance Cinématographique Européenne (A.C.E.) (Paris),85 min,"35mm, 1:1,37","s/w, Ton",,
Der junge Baron Neuhaus,https://www.filmportal.de/film/der-junge-baron-neuhaus_6a9060f4cff8449986fc70d4d9f4aaf5,Spielfilm,1934,Deutschland,Otto Lehmann,,"Robert Herlth, Walter Röhrig",,"Käthe von Nagy: Christl Palm, Viktor de Kowa: Baron Neuhaus, Christl Mardayn: Toni, Hans Moser: Herr Stockel, Lola Chlud: Maria Theresia, Annie Rosar: Frau Stockel, Rudolf Carl: Egelseder, Wilhelm Schich: Oysberger, Beppo Brem: Gaisberger, Karl Hellmer: Sikora, Oskar Sima: Sergeant, Hans Adolfi: Richter Wögerl, Eduard Kandl: Badelhartinger, Walter Simlinger1. Heurigensänger, Ernst Baebler2. Heurigensänger, Rudolf Essek, Josef Herrgesell, Helene Lauterböck, Kurt von Lessen, Heinz Martini, Karl Meixner, Hans Obonya, Klaus Pohl, Josef Reithofer, Betty Sedlmayr, Julius Brandt, Helga Demmer",,,,"Gustav Ucicky, Gerhard Menzel",,"Fritz Schilling, Willi Schlick, Ida Revelli, Elisabeth Massary, Auguste Zademach",Günther Stapenhorst,,Friedl Behn-Grund,"Franz von Klepacki, Herbert Stephan",,,Alois Melichar,"Wilhelm Weber, Emil Neumann, Adolf Arnold, Arthur Schramm, Werner Noack, Maria Jamitzky",Alois Melichar,,Alois Melichar,,Universum-Film AG (UFA) (Berlin),,,Gustav Ucicky,Kurt Hoffmann,"Erich Düring, Karl Mühlberger",Eduard von Borsody,,Horst von Harbou,,Fritz Thiery,,,"2590 m, 95 min","35mm, 1:1,33","s/w, Tobis-Klangfilm",,
Jungfrau gegen Mönch,https://www.filmportal.de/film/jungfrau-gegen-moench_912b60e4c6664d049fe33daad13f7d0d,Spielfilm,1934,Deutschland,Rudolf Fichtner,,"Willi A. Herrmann, Kurt Dürnhöfer",,"Dorit Kreysler: Mutz Hagedorn, Ida Wüst: Tante Jenny Lindemann, Paul Richter: Konrad Leitner, Erik Ode: Geschichtslehrer Dr. Peter Rivius, Hugo Fischer-Köppe: Berliner, Gustl Stark-Gstettenbaur: Hotelpage Fritz, Werner Finck: Gast, Resi Langer: Frau Orlowskaja, Ellen Bang: Pensionsfreundin von Mutz, Maja Feist: Pensionsfreundin von Mutz, Erika Streithorst: Pensionsfreundin von Mutz, Erika Biebrach, Paul Bildt, Harry Hardt, Max W. Hiller, Josef Reithofer, Otto Sauter-Sarto, S. O. Schoening, Otto Stoeckel, Ewald Wenck, Hans von Zedlitz, Edlef Schauer: Schorsch, Liesel Eckhardt: Goldamsel",,,,Willy Rath,,"Senta Schlick, Gustav Jäger",Alfred Zeisler,,Bruno Mondi,"Richard Kandler, Ernst W. Fiedler",,,,Waldemar Jabs,Willi Kollo,Dorit Kreysler,Willi Kollo,,Majestic-Film Gmb: H (Berlin) (Herstellungsgruppe Alfred Zeisler),Helmut Schreiber,"Franz Tappers, Helmut Eweler",E. W. Emo,Toni Huppertz,"Johannes Vonberg, Georg Maier",Martha Dübber,,Eigil Wangoe,,Ludwig Ruhe,,,"9 Akte, 2310 m, 84 min","35mm, 1:1,37","s/w, Tobis-Klangfilm",,
"Ein Kind, ein Hund, ein Vagabund",https://www.filmportal.de/film/ein-kind-ein-hund-ein-vagabund_c52d05ede1c540338ec3774152697b12,Spielfilm,1934,Deutschland,,,,,"Viktor de Kowa: Florian, der Vagabund, Waldemar Müller: Jupp, ein Kind, Annemarie Sörensen: Angelika, eine junge Dame, Willy Schaeffers: Baron von Rehberg, ihr Vater",,,,,,,,,,,,,,,,,,,,,,Arthur Maria Rabenalt,,,,,,,,,,"8 Akte, 2380 m, 87 min","35mm, 1:1.33",s/w,,
Klein Dorrit,https://www.filmportal.de/film/klein-dorrit_ab32ec03729447c2950dd866b455d07e,Spielfilm,1934,Deutschland,,,"Erich Zander, Willi Depenau",,"Gustav Waldau: William Dorrit, Anny Ondra: Amy, seine Tochter, Hilde Hildebrand: Lily, seine Tochter, Kurt Meisel: Pit, sein Sohn, Mathias Wieman: Arthur Clennam, Antonie Jaeckel: Frau Clennam, seine Mutter, Otto Stoeckel: Merdle, sein Freund, Fritz Rasp: Flintwinch, Josef Eichheim: John Chivery, Claire Glib, Jola Jobst, O. E. Hasse, Emil Höfer, Karl Schöpp, Max Weydner",,,,Curt J. Braun,,"Hermann Dor, Dorothea Saumweber",,,"Otto Heller, Ludwig Zahn",Gustav Weiss,Werner Boehm,,Hans H. Zerlett,"Heinrich Beckmann, Leo Wiedemann",Leo Leux,,Leo Leux,,"Ondra-Lamac-Film Gmb: H (Berlin), Bavaria Film AG (München-Geiselgasteig)",Robert Leistenschneider,"Anny Ondra, Carl Lamač, Arthur Hohenberg",Carl Lamač,Herbert Grünewald,Wilhelm Lanz,Ella Ensink,,Hermann Buchrucker,,Friedrich Wilhelm Dustmann,Charles Dickens (Roman »Little Dorrit« (1857)),,,,,,
Der König des Mont Blanc,https://www.filmportal.de/film/der-koenig-des-mont-blanc_9bd54a40edd44477a665936c68497947,Spielfilm,1934,Deutschland,,,"Werner Schlichting, Robert Herlth",,"Sepp Rist: Jacques Balmat, Bauer, Brigitte Horney: Maria, Ernst Petersen: Paccard, Arzt, Eduard von Winterstein: Marias Vater, Wirt, Helene Fehdmer: Marias Mutter, Friedrich Kayßler: Dorfpfarrer, Klaus Pohl: Balmats Vater, Wilhelm Kaiser-Heyl: Professor Saussure, Hans Hermann SchaufußBauer, Walter Riml: Maler, Ernst Dumcke: Dichter, Pierre Provins: Heerführer, Hellmuth Passarge: André, Bergsteiger, Hans Ertl: Bauer, Lothar Ebersberg jun.Jacques Balmat, Kind",,,,Arnold Fanck,,"Margarete Scholz, Willi Schlick",Fritz Klotzsch,,"Richard Angst, Kurt Neubert",Fritz von Friedl,,,,Paul Dannenberg,Giuseppe Becce,,Willy Schmidt-Gentner,,Cine-Allianz Tonfilm Gmb: H (Berlin),,"Arnold Pressburger, Gregor Rabinowitsch",Arnold Fanck,"Willy Clever, Herbert B. Fredersdorf","Erich Düring, Karl Mühlberger",Arnold Fanck,,Fritz Vopel,,Walter Rühland,"Karl Ziak (Historischer Roman ""Paccard wider Balmat"")",,"2620 m, 96 min","35mm, 1:1,19","s/w, Tobis-Klangfilm",,
König Drosselbart und die hochmütige Prinzessin,https://www.filmportal.de/film/koenig-drosselbart-und-die-hochmuetige-prinzessin_6f1acdafd68846eab627da0afcce8110,Spielfilm,1934,Deutschland,,,,,,,,,,,,,,,,,,,,,,,,"Ulf Zengerling, deutsche Märchen-Film-Produktion (Berlin)",,,,,,,,,,,,,,,,,
Konjunkturritter,https://www.filmportal.de/film/konjunkturritter_59e0ac138ad641e39005d16da3d7422c,Spielfilm,1934,Deutschland,,,,,"Weiß-Ferdl: Ferdinand Mühlbauer, Sabine Peters: Gretl, seine Tochter, Hans Adalbert Schlettow: Dr. Lehmann, Rechtsanwalt, Otto Wallburg: Untermeier, Grundstücksspekulant, Kurt Vespermann: Dr. Günther, Rechtsanwalt, Theo Lingen: Glaser, Grundstücksspekulant, Walter Steinbeck: Direktor Messerschmidt, Eugen Rex: Büngermann, Käte Haack: Frau Hornstedt, Gerhard Dammann, Etta Klingenberg, Hans Leibelt, Heinrich Schroth, Eduard Bornträger, Rose Borgh, Anita Mey, Walter Steinweg",,,,"Bobby E. Lüthge, Curt J. Braun",,,,,Herbert Körner,,,,,,,,,,,,,Fritz Kampers,,,,,,,,,,84 min,"35mm, 1:1,37","s/w, Ton",,
Krach um Jolanthe,https://www.filmportal.de/film/krach-um-jolanthe_b4676a032cf546dbb60bc0adf1188b09,Spielfilm,1934,Deutschland,Hugo Froelich,,Franz Schroedter,,"Wilhelm P. Krüger: Bauer Lampken, Marianne Hoppe: Anna, Lampkens Tochter, Olaf Bach: Müller Bunjes, Marieluise Claudius: Sophie, seine Schwester, Albert Lieven: Wesemeier, Lehrer, Karl Dannemann: Rupf, Gendarm, Carsta Löck: Stine, Fritz Hoopts: Hinnerk, Knecht, Max Eckard1. Bauernbursche, Jaspar von Oertzen2. Bauernbursche, Willi Schur: Mahnke, Gerichtsvollzieher, Fita Benkhoff: Erna, Mahnkes Braut, Hugo Froelich: Oncken, Bauer, Richard Handwerk: Borchers, Bauer, Willi Parshen3. Bauernbursche",,,,"Robert A. Stemmle, Walter Supper",,"Edwin Stempel, Elise Bollenhagen",,,Reimar Kuntze,,,,Peter Kirsten,"Max Patyna, Bruno Cieslewicz","Hansom Milde-Meißner, Willy Richartz",,,,Froelich-Film Gmb: H (FFG) (Berlin),Friedrich Pflughaupt,Carl Froelich,Carl Froelich,Arno Winckler,Fritz Bollenhagen,Gustav Lohse,,Alexander Schmoll,,Hans Grimm,,,"2706 m, 99 min","35mm, 1:1.33","s/w, Tobis-Klangfilm",,
Der kühne Schwimmer,https://www.filmportal.de/film/der-kuehne-schwimmer_60f5408b60ad45feb5802fdf128b1fb9,Spielfilm,1934,Deutschland,,,,,,,,,,,,,,,,,,,,,,,,,,,Georg Jacoby,,,,,,,,,,,,,,
The Last Waltz,https://www.filmportal.de/film/the-last-waltz_03003affd048424e9e3bcd8fc87f3cdc,Spielfilm,1934,Deutschland/Großbritannien,,,"Emil Hasler, Robert Gys",,"Jarmila Novotna: Countess Vera Lisavetta, Harry Welchman: Count Dmitri, Gerald Barry: Prince Paul, Josephine Huntley Wright: Babushka, Tonie Edgar-Bruce: Countess, Betty Huntley Wright, Bruce Winston, Paul Sheridan",,,,Reginald Arkell,,,,,Carl Drews,,,,,,Oscar Straus (unter Verwendung eigener Kompositionen),,Paul Hühn,,"Gnom-Tonfilm Gmb: H (Berlin), Warwick Films Ltd. (London)",,Gina Carlton,"Leo Mittler, Gerald Barry",Hanns Theo Grust,,,,,,Carl Becker,,,"6580 ft = 2006 m, 72 min","35mm, 1:1.33","s/w, Tobis-Klangfilm",,
The Legend of William Tell,https://www.filmportal.de/film/the-legend-of-william-tell_ee66d799f3ce4bc0a4377d82b5b74cce,Spielfilm,1934,Deutschland/Schweiz,,,"Robert A. Dietrich, Bruno Lanz",,"Hans Marr: Wilhelm Tell, Conrad Veidt: Landvogt Gessler, Emmy Sonnemann: Hedwig Tell, Charles Cullum: Arnold von Melchthal, Eugen Klöpfer: Heinrich von Melchthal, Maly Delschaft: Barbara von Melchthal, Dennis Aubrey: Werner Stauffacher, Franziska Kinz: Gertrud Stauffacher, Carl de Vogt: Konrad Baumgarten, Käte Haack: Baumgartnerin, seine Frau, Edmond Willard: Walter Fürst, Detlef Willecke: Walter, Tells Sohn, Wolfdieter Hollender: Klein-Wilhelm, Tells jüngster Sohn, Werner Schott: Vogt Landenberg, Friedrich Ettel: Vogt Wolfenschiess, Josef Peterhans: Pfarrer Rösselmann, Herma Clement: Armgard, Paul Bildt: Schultheiss von Luzern, Max Hochstetter, Wilhelm Haardt, Heinrich Schroth, Georg Heinrich Schnell",,,,"Hanns Johst, Heinz Paul, Hans Curjel, Wilhelm Stöppler",,,,,"Sepp Allgeier, Franz Weihmayr, Franz Josef Dahinden",,Alfred Bader,,,,Herbert Windt,,,,"Terra-Film AG (Berlin), Schweizer-Produktion der Terra-Film AG (Zürich), Schweizer Film-Finanzierungs-AG (Zürich)","Max G. Hüske, C. A. Schlaepfer",Ralph Scotoni (Gesamtleitung),"Heinz Paul, Manning Haynes",,Alfred Bader,Paul May,,Niedecken,,Emil Specht,Friedrich Schiller (Bühnenstück),,,"35mm, 1:1,37","s/w, Ton",,
Der letzte Walzer,https://www.filmportal.de/film/der-letzte-walzer_dbb9630d6e464092911f772ef82bea90,Spielfilm,1934,Deutschland,,,Emil Hasler,,"Adele Sandrock, Eduard von Winterstein, Helmut Rudolph, Camilla Horn, Walter Steinbeck",,,,,,,,,,,,,,,,,,,,,,Georg Jacoby,,,,,,,,,,,,,,
Liebe dumme Mama,https://www.filmportal.de/film/liebe-dumme-mama_ceb58868fc784777be0ea03fb0d75adc,Spielfilm,1934,Deutschland,"Gustav Lautenbacher, Karl Sander",,Max Seefelder,,"Leopoldine Konstantin: Helene Burkhardt, Luise Ullrich: Hedie, ihre Tochter, Hermann Thimig: Leo Heiderich, Gustav Waldau: Heiderich sen., Theo Lingen: Fischer, Hoteldirektor, Walter Lantzsch: Portier, Otto Wernicke: Inspektor Beneke, Paul Henckels: Professor im Pensionat, Hans Richter: Boy, Liesl Karlstadt: Almwirtin, Philipp Veit: Notar",,,,Walter Wassermann,,,,,Franz Koch,,,,Hans Martin Cremer,,Hans Carste,,Lewis Ruth,,"Atalanta-Film Gmb: H (Berlin), Bavaria Film AG (München-Geiselgasteig)",,Otto Ernst Lubitz,Carl Boese,,,"Ella Ensink, Gottlieb Madl",,Rudolf Reißner,,"Karl-Albert Keller, Friedrich Wilhelm Dustmann",,,,,,,
Die Liebe siegt,https://www.filmportal.de/film/die-liebe-siegt_d91d330b694445e2a104e795963fefcd,Spielfilm,1934,Deutschland,,,Erich Czerwonski,,"Trude Marlen: Renée Neumann, Stenotypistin, Susi Lanner: Elli, ihre Schwester, Sängerin, Jakob Tiedtke: Ihr Vater, Hausverwalter, Carl Esmond: Willy Schneider, Fotograf, Rudolf Platte: Max Brehmer, Willys Freund, Musiker, Alfred Abel: Direktor Berger, Blandine Ebinger: Annie,  Bergers Frau, Werner Finck: Döring, Bergers Reklamechef, Otto Krone: Hagemann, Bergers Sekretär, Hans Albin, Traute Bengen, Heinz Berghaus, Erich Fiedler, Annemarie Hase, Antonie Jaeckel, Inge Kadon, Ernst Legal, Gustav Mahncke, Hadrian Maria Netto, Josef Reithofer, Arthur Reppert, Otto Sauter-Sarto, Felicitas Scholz, Valeska Stock, Emmy Wyda",,,,"Sybil Moholy-Nagy, Georg Zoch",,,,,Ewald Daub,,,,Richard Busch,,Harald Böhmelt,,,,Westropa-Film AG (Berlin),Hans Conradi,,Georg Zoch,,,,,,,Adolf Jansen,,,"2415 m, 87 min","35mm, 1:1.,33","s/w, Tobis-Klangfilm",,"Zensur (DE): 17.10.1934, B.37518, Jugendvebot"
Die Liebe und die erste Eisenbahn,https://www.filmportal.de/film/die-liebe-und-die-erste-eisenbahn_e016df67fbba4bbcbde9f5de0900aa7c,Spielfilm,1934,Deutschland,,,Otto Gülstorff,,"Jakob Tiedtke: Friedrich W. Eichmann, Posthalter in Zehlendorf, Ida Wüst: Helene Eichmann, Hans Schlenck: Dampfwagen-Ingenieur Ferdinand Miller, Karin Hardt: Brigitte, Fritz Kampers: Faktotum Paul Kluthammer, Genia Nikolajewa: Nanette, Max Gülstorff: B.C. Fechner, Paul Westermeier: Eckensteher Nante, Hans Zesch-Ballot: Schelling, Ernst Behmer: Landbriefträger, Josefine Dora",,,,Curt J. Braun,,,,,Carl Drews,,,Robert Neppach,,,Harald Böhmelt,,,,"R. N.-Filmproduktion Gmb: H, Robert Neppach (Berlin)",,Robert Neppach,Hasso Preiß,,,,,,,Carlheinz Becker,,,,,,,
"Liebe, Tod und Teufel",https://www.filmportal.de/film/liebe-tod-und-teufel_a3dad86ac3324da48c9224bf36779634,Spielfilm,1934,Deutschland,Fritz Koch,,Otto Hunte,,"Käthe von Nagy: Kokua, Albin Skoda: Matrose Kiwe, Brigitte Horney: Sängerin Rubby, Karl Hellmer: Lopaka, Aribert Wäscher: Mounier, Erich Ponto: Alter Flaschenverkäufer, Paul Dahlke: Gouverneur, Rudolf Platte: Wirt Spunda, Oskar Sima: Händler Kiano, Albert Florath: Notar, S. O. Schoening: Collins, Walter Ladengast: Matrose Jerry, Josef Dahmen: Matrose Macco, Hans Kettler: Balmer, Karl Hannemann: Matrose Hein, Fred Immler: Matrose Wikham, Kurt Uhlig: Matrose Tirill, Charly Berger, Gertrud Boll, Fritz Digruber, Marita Gründgens, Nico Habel, Oskar Höcker, Jutta Jol, P. Luca-Kammerer, Eugen Malkowski, Hellmuth Passarge, Klaus Pohl, Herbert Spalke, Arnim Süssenguth, Hedy Swedenburg",,,,"Kurt Heuser, Josef Pelz von Felinau, Liselotte Gravenstein",,"Paul Haupt, Max König, Ida Revelli",Karl Ritter,,Fritz Arno Wagner,Werner Krien,Herbert Ploberger,,Hans Fritz Beckmann,Waldemar Jabs,Theo Mackeben,,Theo Mackeben,,Universum-Film AG (UFA) (Berlin) (Herstellungsgruppe Karl Ritter),Karl Ritter,,"Heinz Hilpert, Reinhart Steinbicker",,"Otto Rülicke, Otto Arndt",Wolfgang Becker,,Horst von Harbou,,Erich Leistner,"Robert Louis Stevenson (Erzählung ""The Bottle Imp"" / ""Das Flaschenteufelchen"")",,"11 Akte, 2854 m, 104 min","35mm, 1:1,37","s/w, Tobis-Klangfilm",,
