Titel,Link,Genre,Jahr,Land,Aufnahmeleitung,Bauausführung,Bauten,Choreografie,Darsteller,Dialoge,Dramaturgie,Dreharbeiten,Drehbuch,Erstverleih,Garderobe,Herstellungsleitung,Idee,Kamera,Kamera-Assistenz,Kostüme,KünstlerischeOberleitung,Liedtexte,Maske,Musik,Musik-Ausführung,MusikalischeLeitung,MusikalischeVorlage,Produktionsfirma,Produktionsleitung,Produzent,Regie,Regie-Assistenz,Requisite,Schnitt,Script,Standfotos,Supervision,Ton,Vorlage,im Auftrag von,Länge,Format,Bild/Ton,Aufführung,Prüfung/Zensur
Achtung Harry! Augen auf!,https://www.filmportal.de/film/achtung-harry-augen-auf_c553696099294c7ca02778682da0b1ec,Spielfilm,1926,Deutschland,,,Willi A. Herrmann,,"Harry Piel: Ein junger Reporter, Eugen Burg: Graham Horst, Besitzer des Kontinental-Kuriers, Denise Legeay: Ethel Horst, seine Tochter, Jaro Fürth: Chefredakteur, Colette Corder""Rote Gräfin"", Karl Falkenberg: Prinz Achmed, Georg John: Nathan Miller",,,,"Henrik Galeen, Harry Piel",,,,,"Georg Muschner, Gotthardt Wolf",,,,,,,,,,Phoebus-Film AG (Berlin),,,Harry Piel,,,,,,,,,,,,,,
Die Akten der Hella Morgins,https://www.filmportal.de/film/die-akten-der-hella-morgins_bbf87c38282a46679b9d278d1d5f66e9,Spielfilm,1926,Deutschland,,,,,Edda Lindborg,,,,,,,,,,,,,,,,,,,,,,Franz Hofer (ungesichert),,,,,,,,,,,,,,
Als ich wiederkam,https://www.filmportal.de/film/als-ich-wiederkam_f721a4937bf642bea942f3cb5a78ffa4,Spielfilm,1926,Deutschland,,,Heinrich Richter,,"Liane Haid: Josefa Voglhuber, Wirtin, Max Hansen, Henry Bender: Wilhelm Giesecke, Livio C. Pavanelli, Maly Delschaft: Ottilie Giesecke, Hermann Picha: Hinzelmann, Privatgelehrter, Ferdinand Bonn, Anton Pointner, Anita Dorris",,,,"Alfred Halm, Lothar Knud Frederik",,,,,Arpad Viragh,,,,,,Hans May (Kino-Musik),,,,Richard Oswald-Produktion Gmb: H (Berlin),,,Richard Oswald,,,,,,,,,,,,,,
Der Amateur oder Die große Wette,https://www.filmportal.de/film/der-amateur-oder-die-grosse-wette_30637e0f43dd47e8bbf43d4a49bfc2ee,Spielfilm,1926,Deutschland,,,,,Ernst Reicher?,,,,,,,,,,,,,,,,,,,Stuart Webbs Comp.,,,Ernst Reicher (?),,,,,,,,,,,,,,
An der schönen blauen Donau,https://www.filmportal.de/film/an-der-schoenen-blauen-donau_6d6eeb2a089d4eb7b0d9beabe42488a5,Spielfilm,1926,Deutschland,,,"Andrej Andrejew, Jacek Rotmil",,"Lya Mara: Mizzi, Harry Liedtke: Graf Oskar Zirsky, Ernö Verebes: Graf Rudi Zirsky, Julius Falkenstein: Erbgraf Zirsky, Hans Junkermann: Erzherzog Ignaz, Olga Engl: Gräfin Zirsky, Albert Paulig: Adjutant, Henry Bender: Graf Casimir, Hans Albers: Graf Jaromir, Arthur Kraußneck: Josef Stingl, Karl Platen: Florian Staudinger, Schuhmachermeister, Max Leffle: Kardinal Graf Zirsky, Frida Richard, Hugo Döblin",,,,"Fanny Carlsen, Willy Haas",,,,,Frederik Fuglsang,,,,,,Willy Schmidt-Gentner (Kino-Musik),,,,Friedrich-Zelnik-Film Gmb: H (Berlin),,Friedrich Zelnik,Friedrich Zelnik,,,,,,,,,D.L.S. (Berlin),2690 m,"35mm, 1:1,33","s/w, ohne Ton",,
Annemarie und ihr Ulan,https://www.filmportal.de/film/annemarie-und-ihr-ulan_ae9722e51c8040b083b126dbfecf753c,Spielfilm,1926,Deutschland,,,Karl Machus,,"Colette Brettel: Terry von Struppwitz, Siegfried Arno: Günther Bock, Einjähriger bei den Ulanen, Hans Junkermann: Oberstleutnant Strupp von Struppwitz, Elsa Wasaseine Frau, Julius Falkenstein: Oberleutnant von Gelbsattel, Carl Auen: Leutnant Aribert Graf von Nedlitz, Kurt Gerron: Wachtmeister, Paul Westermeier: Paul Lehmann, Ulan, sein Bruder, Ellen Plessow: Gräfin Nedlitz auf Borstenfeld, Hermann Picha: Jochen, ihr Kammerdiener, Manja Tzatschewa: Benita, eine Tänzerin vom Maxim, Henry Bender: Kommissionsrat Julius Bock, Besitzer einer Drogeri, Emmy Wydaseine Frau, Evi Eva: Käthe, deren Tochter, Hanne Brinkmann: Annemarie, Bocks Köchin, Gerhard Ritterband: August, Bocks Lehrling, Karl Harbacher: Lohndiener",,,,Alexander Alexander,,,,,Willy Großstück,,,,,,,,,,,,,Erich Eriksen,,,,,,,,,,70 min,"35mm, 1:1,33","s/w, stumm",,
Bara en danserska,https://www.filmportal.de/film/bara-en-danserska_4a2d4baeb4e74169bb8f35d1eb207b01,Spielfilm,1926,Deutschland/Schweden,,,Franz Schroedter,,"Lil Dagover: Marie Tippner, Jakob Tiedtke: Alois Zentler, Rentier, Lucie Höflich: Frau Radinger, Karin Swanström: Frau Zentler, Ivan Hedqvist: Baron von Wittenberg, Heinrichs Pate, Anna-Lisa Ryding: Grete, Hertha von Walther: Angeklagte, Walter Janssen: Paul, Nils Ahrén: Radinger, Landgerichtsdirektor, Harry Halm: Heinrich, Hermann Picha, Robert Leffler: Freunde im Hause Zentler, Hans Albers: Lebemann, Clementine Plessner: Köchin im Hause Zentler, Michael Tschernoff: Portier im Hause Zentler, Uno Henning, Hugo Döblin",,,,"Paul Merzbach, Olof Molander",,,,,"Franz Planer, Hugo Edlund",,,,,,Otto Stenzeel (Kino-Musik),,,,Isepa-Wengeroff-Film Gmb: H (Berlin),"Oscar Hemberg (Svenska-Film, Stockholm)",,Olof Molander,,,,,Curt Oertel,,,,,,"35mm, 1:1,33","s/w, ohne Ton",,
Der Bergadler,https://www.filmportal.de/film/der-bergadler_9cb8757bf2314187a6ef5c21bd0e0cf2,Spielfilm,1926,Deutschland,,,"Willy Reiber, Ludwig Reiber",,"Nita Naldi: Dorfschullehrerin, Bernhard Goetzke: Bürgermeister Petermann, Malcolm Keen: Gottfried, der Bergadler, John Hamilton: Sohn des Bürgermeisters, Ferdinand Martini",,,,"Max Ferner, Charles Lapworth, Eliot Stannard",,,,,Gaetano di Ventimiglia,,,,,,,,,,Emelka-Konzern (München),,,Alfred Hitchcock,,,,,,,,,,"7 Akte, 2171 m",,,,
Bismarck 1862 - 1898,https://www.filmportal.de/film/bismarck-1862-1898_bd2e3573ff0d4b5db43ca7b8924cb451,Spielfilm,1926,Deutschland,,,Willi A. Herrmann,,"Franz Ludwig: Otto von Bismarck, Robert Leffler, Erna Morena, Ralph Ludwig: Otto von Bismarck als Knabe, Bruno Ziener, Heinrich Peer, Adolf Klein, Victor Senger, Wolfgang von Schwindt, Rudolf Lettinger, Maria Santen, Carl de Vogt, Barbara von Annenkoff, Hugo Flink, Eugen Möbius",,,,Ludwig Ziehen,,,,,Willy Großstück,,,,,,Felix Bartsch (Kino-Musik),,,,,,,Curt Blachnitzky,,,,,,,,,,,,,,
Bleibe im Lande,https://www.filmportal.de/film/bleibe-im-lande_52fa33f505e54cf8bfa09d8650e084db,Spielfilm,1926,Deutschland,,,,,,,,,,,,,,,,,,,,,,,,,,,,,,,,,,,,,,,,,
Die Boxerbraut,https://www.filmportal.de/film/die-boxerbraut_314262149fd742fdb9309856320db4ec,Spielfilm,1926,Deutschland,,,Erich Czerwonski,,"Xenia Desni: Helen von Vliet, Willy Fritsch: Fritz Spitz, Hermann Picha: Siegfried Spitz, sein Vater, Teddy Bill: Heinz Cordon, Harry Lamberts-Paulsen: Ernst Kempers, Meisterboxer, Alice Kempen: Lissy, Louis Brody: Fighting Bob",,,,"Robert Liebmann, Heinz Gordon",,,,,Theodor Sparkuhl,,,,,,,,,,,,,Johannes Guter,,,,,,,,,,2019 m,"35mm, 1:1,33","s/w, ohne Ton",,
Die Brüder Schellenberg,https://www.filmportal.de/film/die-brueder-schellenberg_d0c41077936e4ec3984a47afc113592c,Spielfilm,1926,Deutschland,,,"Karl Görge, Curt Kahle",,"Conrad Veidt: Wenzel Schellenberg / Michael Schellenberg, Lil Dagover: Esther Raucheisen, Liane Haid: Jenny Florian, Henry de Vries: Fabrikbesitzer Raucheisen, Werner Fuetterer: Georg Weidenbach, Bruno Kastner: Kaczinsky, Julius Falkenstein: Esthers 1. Verehrer, Wilhelm Bendow: Esthers 2. Verehrer, Erich Kaiser-Titz: Esthers 3.Verehrer, Paul Morgan: Schieber, Jaro Fürth: Wucherer, Frida Richard: Verarmte Witwe",,,,"Willy Haas, Karl Grune",,,,,"Curt Courant, Karl Hasselmann",,,,,,Werner Richard Heymann (Kino-Musik),,Ernö Rapée (Bei der Uraufführung),,Universum-Film AG (UFA) (Berlin),,Erich Pommer,Karl Grune,,,,,,,,Bernhard Kellermann (Roman),,"7 Akte, 2834 m","35mm, 1:1,33","s/w, stumm",,
"Bushido, das eiserne Gesetz",https://www.filmportal.de/film/bushido-das-eiserne-gesetz_21d24d6b4c74446ab9538237ad63f776,Spielfilm,1926,Deutschland,,,,,"Loo Holl, Carl W. Tetting, W. Ahashi, Tsuyaka Okajiama",,,,Heinz Carl Heiland,,,,,,,,,,,Walter Ulfig (Kino-Musik),,,,Deutsch-Nordische Film-Union Gmb: H (Berlin),,,"Heinz Carl Heiland, Zamnu Kako",,,,,,,,,,,,,,
Dagfin,https://www.filmportal.de/film/dagfin_90ad3a5025344c7a9ea92680438745dc,Spielfilm,1926,Deutschland,Robert Wuellner,,"Erich Zander, Ernst Schütte",,"Paul Richter: Skilehrer Dagfin Holberg, Marcella Albani: Lydia Boysen, Paul Wegener: Türkischer General Sabi Bey, Mary Johnson: Tilly von Gain, Alfred Gerasch: Axel Boysen, Hedwig Wangel: Lydias Zofe, Alexander Murski: Oberst von Gain, Nien Sön Ling: Sabi Beys Sekretär Garron, Ernst Deutsch: Armenier Assairan, Paul Biensfeldt",,,,"Joe May, Adolf Lantz, Jane Bess, Hans Székely",,,,,"Carl Drews, Edgar S. Ziesemer",,,,,,Willy Schmidt-Gentner (Kino-Musik bei der Uraufführung)),,,,May-Film AG (Berlin),,Joe May,Joe May,,,,,,,,"Werner Scheff (Roman ""Dagfin, der Schneeschuhläufer"")",Phoebus-Film AG (Berlin),"10 Akte, 3389 m","35mm, 1:1,33","s/w, ohne Ton",,
Das war in Heidelberg in blauer Sommernacht,https://www.filmportal.de/film/das-war-in-heidelberg-in-blauer-sommernacht_d8701f3ee24445cc8a808195d8632f1d,Spielfilm,1926,Deutschland,,,Willi A. Herrmann,,"Fritz Alberti: Sanitätsrat Liningen, Frida Richard: Großmutter Liningen, Eduard von Winterstein: Gutsbesitzer Wagner, Antonie Jaeckel: Deine Frau, Charlotte Susa: Grete, Tochter, Ernst Rückert: Rudolf, Sohn, Olga Engl: Frau v. Helling, Hertha von Walther: Hertha, deren Tochter, Julius Falkenstein: Stransky, Karl Etlinger: Ehrenfleck, Schmierenschauspieler, Tonio Gennaro: Der erste Chargierte, Max Maximilian: Korpsdiener, Fritz Beckmann: Revuedirektor, Margarete Kupfer: Studentenwirtin, Fritz Schroeter: Geldverleiher",,,,Siegfried Philippi,,,,,Josef Dietze,,,,,,,,,,,,,Emmerich Hanus,,,,,,,,,,"6 Akte, 2395 m",,"s/w, stumm",,
Der Liebe Lust und Leid,https://www.filmportal.de/film/der-liebe-lust-und-leid_1bd03c098b7f42d19bdbba397e42eb51,Spielfilm,1926,Deutschland,,,Karl Machus,,"Charlotte Susa, Margarete Kupfer, Hilde Maroff, Maria Forescu, Emmy Wyda, Marion Illing, Grete Schmidt, Sylvia Torff, Hilde Hofer-Pittschau, Hans Mierendorff, Ernst Rückert, Fritz Rasp, Kurt Gerron, Charles Willy Kayser, Hermann Picha, Robert Garrison, Ernst Behmer, Ludwig Sachs, Philipp Manning, Antonie Jaeckel, Albert Dettmann",,,,Helene Lackner,,,,,Arpad Viragh,,,Heinz Schall,,,,,,,,,,Kurt Gerron,,,,,,,,,,,"35mm, 1:1,33","s/w, stumm",,
Der siebente Junge,https://www.filmportal.de/film/der-siebente-junge_16558f3b346148c69f3f1384a10dfa6f,Spielfilm,1926,Deutschland,,,Max Heilbronner,,"Ferdinand Martini: Wendelin Nimmersatt, Gymnasiallehrer, Elise Aulinger: Klothilde Nimmersatt, Ehefrau, Martin Lindemann: Fürst Clemens VIII., Maria Minzenti: Konstantine, Tochter des Fürsten, Carl Walther Meyer: Prinz Artur, Hilde Horst: Evchen Bergner, Nimmersatts Nichte, Hermann Pfanz: Eusebius Riemenschneider, Privatgelehrter, Ella Schönermann-Heuberger: Ludmila, John W. Lantzsch: Alter, André Pilot",,,,Max Ferner,,,,,Franz Koch,,,,,,,,,,,,,Franz Osten,,,,,,,,,,,,,,
Derby. Ein Ausschnitt aus der Welt des Trabersports,https://www.filmportal.de/film/derby-ein-ausschnitt-aus-der-welt-des-trabersports_4574484db1e741a38972fe1030f6c585,Spielfilm,1926,Deutschland,,,"Erich Zander, Ernst Schütte",,"Barbara von Annenkoff: Kitty Roy, Henry Stuart: Baron von Reiffenberg, Alexandra Nadler: Liesel, seine Tochter, Otto Wallburg: Emil Henschke, Fleischwaren en gros, Grete Mosheim: Edith, seine Tochter, Franz Lingner: Arpad Varady, Gerd Fricke: Alf Winkfield, Robert Leffler: Claren, Max Nosseck",,,,"Wilhelm Stücklen, Curt J. Braun",,,,,"Carl Drews, Edgar S. Ziesemer, Albert Schattmann",,,Joe May,,,Willy Schmidt-Gentner (Kino-Musik),,,,May-Film der Phoebus-Film AG (Berlin),,Joe May,Max Reichmann,,,,,,,,Ernst Klein (Roman),,"2405 m, 88 min","35mm, 1:1,33","s/w, stumm",,"Zensur (DE): 15.09.1926, B.13904, Vor Jugendlichen verboten"
Des Königs Befehl,https://www.filmportal.de/film/des-koenigs-befehl_fd903fb052064731aad9adbc5e71a593,Spielfilm,1926,Deutschland,,,"Willi A. Herrmann, Ernst Meiwers",,"Georg Burghardt, Grete Reinwald, Hanni Reinwald, Hans Brausewetter, Fritz Alberti, Eduard von Winterstein, Leopold von Ledebur, Karl Platen, Georg John, Hans Stüwe",,,,Hans Vietzke,,,,,"Willy Großstück, Viktor A. Zimmermann",,,,,,Hans May (Kino-Musik),,,,,,,Curt Blachnitzky,,,,,,,,,,,,,,
Des Rajahs große Liebe. Der Welt sensationellster Prozeß,https://www.filmportal.de/film/des-rajahs-grosse-liebe-der-welt-sensationellster-prozess_ca3eef62252e4e9f84e504eb4d2d701e,Spielfilm,1926,Deutschland,,,,,,,,,,,,,,,,,,,,,,,,,,,Edmund Linke,,,,,,,,,,,,,,
Deutsche Herzen am deutschen Rhein,https://www.filmportal.de/film/deutsche-herzen-am-deutschen-rhein_82d50fa61b3b4a109b07172546380591,Spielfilm,1926,Deutschland,,,Willi A. Herrmann,,"Grete Reinwald: Maria, Hans Adalbert Schlettow: Hans Schüttenhaus, Fabrikbesitzer, Adele Sandrock: Frau Weber, die Wirtin vom ""Alten Haus"", Hans Albers: Helmut Schüttenhaus, Vetter des Fabrikbesitzers, Julius von Szöreghy, Eberhard Leithoff: Joseph, Uhrmacher, Frieda Lehndorff: Mutter Kühne, Editha Seidel: Bärbel, Rudolf del Zoppder alte Peters, Werkmeister, Manja Walowska",,,,"Max Jungk, Julius Urgiß",,,,,Willy Goldberger,,,,,,Felix Bartsch (Kino-Musik),,,,,,,Fred Sauer,,,,,,,,,,,"35mm, 1:1,33","s/w, ohne Ton",,
Das deutsche Mutterherz,https://www.filmportal.de/film/das-deutsche-mutterherz_9f49836eb20f4eb48e01cfcb8f9aab37,Spielfilm,1926,Deutschland,,,"Otto Völkers, Peter Rochelsberg",,"Margarete Kupfer: Witwe Erdmann, Ellen Kürty: Kellnerin, Julius Messaros: Julius, Heinz Rühmann: Oskar, Vera Veronina, Carl Walther Meyer, Helene von Bolváry, Leon Epp, Max Weydner",,,,Margarete M. Langen,,,,,Hans Karl Gottschalk,,,,,,Hans May (Kino-Musik),,,,,,,Géza von Bolváry,,,,,,,,,,,,,,
Die vom Schicksal Verfolgten,https://www.filmportal.de/film/die-vom-schicksal-verfolgten_5aab34cdf4274f289f588232d0dbb638,Spielfilm,1926,Niederlande/Deutschland,,,"Robert A. Dietrich, Franz Seemann",,"Henkie Klyn, Willem van der Veer: Koert, der Vater, Aud Egede-Nissen: Riek, die Mutter, Wilhelm Dieterle: Onkel Ko, Adele Sandrock: Tante Toos, Henry de Vries: Polizeikommissar",,,,"Kurt Steinrück, Henk Kleinman",,,,,Adolf Otto Weitzenberg,,,,,,,,,,"Omnia-Film Gmb: H (Berlin), Van der Veer-Kleinman Film (Amsterdam)",,"Willem van der Veer, Henk Kleinman",Henk Kleinman,,,,,,,,,,,,,,
Don Juan wider Willen,https://www.filmportal.de/film/don-juan-wider-willen_3de5298d490d463283c1bd44bd9f2890,Spielfilm,1926,Deutschland,,,,,,,,,,,,,,,,,,,,,,,,,,,,,,,,,,,,,"1921 m, 70 min",35mm,,,
Die drei Kuckucksuhren,https://www.filmportal.de/film/die-drei-kuckucksuhren_333b2c6715934af2b0914fca61af32c0,Spielfilm,1926,Deutschland,,,Hans Jacoby,,"Lilian Hall-Davis: Gladys Clifton, Eric Barclay: Lord Ernest Clifton, Nils Asther: Reginals Ellis, Albert Steinrück: Mason, Nina Vanna: Mary Davids, Hermann Vallentin: Lakington, Paul Graetz: Hotelmanager",,,,Robert Liebmann,,,,,Fritz Arno Wagner,,,,,,,,,,,,,Lothar Mendes,,,,,,,,,,2081 m,,stumm,,
Die drei Mannequins (Die drei Probiermamsells),https://www.filmportal.de/film/die-drei-mannequins-die-drei-probiermamsells_e358fc9f5f6344509bef3b5df4924fbc,Spielfilm,1926,Deutschland,,,Hans Jacoby,,"Grit Haid: Mannequin, Helga Molander: Mannequin, die Braut des Einkäufers, Elisabeth Pinajeff: Mannequin, Anton Pointner: Fred, Einkäufer und Geschäftsführer, Hans Albers: Hochstabler, Paul Graetz: Lagerist Meyer, Ferry Sikla: Kommerzienrat, Hermann Picha: Leiter einer Mannequinschule, Lydia Potechina: Frau Gold, Besitzerin des Modesalons, Hans Brausewetter, Robert Garrison, Siegfried Berisch, Kurt Gerron, Emil Heyse, Jenny Marba, Paul Morgan, Toni Tetzlaff",,,,Max Glass,,,,,Gustave Preiß,,,,,,Willy Schmidt-Gentner (Kino-Musik),,,,,,,Jaap Speyer,,,,,,,,,,,"35mm, 1:1,33","s/w, stumm",,
Die dritte Eskadron,https://www.filmportal.de/film/die-dritte-eskadron_748b461702354985955450c0223a39f4,Spielfilm,1926,Deutschland,,,"Hans Sohnle, Otto Erdmann",,"Claire Rommer: Julie, das Fräulein Rittmeister, Fritz Spira: Kaiser Franz Joseph, Eugen Burg: Herr Oberst, Ida Wüst: Emilie, die Frau Oberstin, Ralph Arthur Roberts: Herr Rittmeister Vertessy, Julius von Szöreghy: Rittmeister der Reserve von Mikosch, Camilla Spira: Ilonka, seine Tochter, Paul Heidemann: Oberleutnant Huber, Ernö Verebes: Leutnant Edler, Paul Morgan: Oberarzt, Kurt Vespermann: Einjährig-Freiwilliger, Siegfried Arno: Husar Mischka Rappaport, Karl Victor Plagge: Husar Pali, Ressel Orla: Mizzi Blank, Tänzerin, das Verhältnis der Eskadron, Robert Garrison: Max Freundlich, der Finanzier der Eskadron, Albert Paulig: Jánós, Mikoschs Diener, Anton Pointner, Leopold von Ledebur, Lydia Potechina",,,,"Bobby E. Lüthge, Carl Wilhelm",,,,,"Gustav Ucicky, Eduard von Borsody",,,,,,Hans May (Kino-Musik),,,,Domo-Strauß-Film Gmb: H (Berlin),,,Carl Wilhelm,,,,,Walter Lichtenstein,,,Bernhard Buchbinder (Bühnenstck),,,"35mm, 1:1,33","s/w, stumm",,
Droben stehet die Kapelle,https://www.filmportal.de/film/droben-stehet-die-kapelle_33310cdf085b445ebfe9dd408c45861d,Spielfilm,1926,Deutschland,,,,,,,,,,,,,,,,,,,,,,,,,,,,,,,,,,,,,,,,,
Dürfen wir schweigen?,https://www.filmportal.de/film/duerfen-wir-schweigen_ef2d5f740d8142cd99bfa7568bbb0ef6,Spielfilm,1926,Deutschland,,,Heinrich Richter,,"Conrad Veidt: Paul Hartwig, Maler, Walter Rilla: Dr. Georg Mauthner, Henry de Vries: Henry Pierson, Stadtrat, Mary Parker: Leonie, seine Tochter, Elga Brink: Assistentin, Frida Richard: Alte Frau, Ernst Laskowski: Junger Mann, Maria West: Junge Frau, Fritz Kortner: Annoncierender Arzt, John Gottowt: Sein Faktotum, Maria Forescu1. Patientin, Else Plessner2. Patientin, Betty Astor: Inge, Albert Paulig: Ober, Ernst Stammer: Wirt, Bella Polini: Tänzerin, Ernö Verebes: Gerd",,,,Richard Oswald,,,,,Gustav Ucicky,,,,,,Hans May (Kino-Musik),,,,Nero-Film Gmb: H (Berlin),,,Richard Oswald,,,,,,,,,,2686 m,"35mm, 1:1,33","s/w, stumm",,
Der dumme August des Zirkus Romanelli,https://www.filmportal.de/film/der-dumme-august-des-zirkus-romanelli_3378851326984763b338a045d336661f,Spielfilm,1926,Deutschland,,,"Hans Sohnle, Otto Erdmann",,"Reinhold Schünzel: Der dumme August, Claire Rommer: Viola, Victor Janson: Herr Direktor, Trude Hesterberg: Frau Direktor, Anton Pointner: Robert, Violas Bräutigam, Kunstreiter, Siegfried Arno: Jolli, Sister Brothers de Frère, Paul Westermeier: Polli, Sister Brothers de Frère, Julius Falkenstein: Eberhard, Majoratsherr auf Stockeling, Elga Brink: Hella, seine Nichte, Fritz Greiner: Karussellbesitzer, Hermann Picha, Paul Biensfeldt, Paul Morgan",,,,"Alfred Schirokauer, Reinhold Schünzel",,,,,"Otto Kanturek, Gustave Preiß",,,,,,Willy Schmidt-Gentner (Kino-Musik),,,,Domo-Strauß-Film Gmb: H (Berlin),,,Georg Jacoby,,,,,Walter Lichtenstein,,,,,"6 Akte, 2093 m","35mm, 1:1.33","s/w, stumm",,
Einigkeit und Recht und Freiheit,https://www.filmportal.de/film/einigkeit-und-recht-und-freiheit_f4b51d0d41cc45f485ae3d564bf19926,Spielfilm,1926,Deutschland,,,,,,,,,,,,,,,,,,,,,,,,Nivelli-Film (Berlin),,,Joseph Delmont (?),,,,,,,,,,"6 Akte, 1946 m",,"s/w, Stumm",,
Die Elenden der Straße,https://www.filmportal.de/film/die-elenden-der-strasse_a102dd29d8b24dac8fc9fb270c90ccfe,Spielfilm,1926,Deutschland,,,Franz Seemann,,"Liselotte Krämer: Kind, Eva Speyer, Aruth Wartan",,,,Toni Dathe,,,,,Albert Schattmann,,,,,,,,,,,,,Albert Krämer,,,,,,,,,,,,,,
Die elf Schillschen Offiziere,https://www.filmportal.de/film/die-elf-schillschen-offiziere_c4345f660f2a46699c301564fcef01e5,Spielfilm,1926,Deutschland,,,Gustav A. Knauer,,"Rudolf Meinert: Major von Schill, Gustav Adolf Semler: König Friedrich Wilhelm III. von Preußen, Grete Reinwald: Königin Luise, Leopold von Ledebur: Freiherr von Wedel, Mary Nolan: Marie, seine Tochter, Ernst Rückert: Fritz, sein Sohn, Werner Pittschau: Udo von Reckenthin, Fritz Greiner: Freiherr von Mallwitz, Albert Steinrück: Der französische Kammandant, Charles Willy Kayser: Französischer Offizier, Camilla von Hollay: Minne, Henri Peters-Arnolds: Franz, ein Knecht, Jack Mylong-Münz: Freischärler, Else Reval, Aruth Wartan, Fred Immler, Edgar Hellwald, Jaro Fürth, Mark Asarow, Clementine Plessner, Emmerich Hanus, Rudolf del Zopp, Kurt Thormann, Bobby Bender",,,,"Max Jungk, Julius Urgiß",,,,,Ludwig Lippert,,,,,,,,,,Internationale Film-AG (Ifa) (Berlin),,Rudolf Meinert,Rudolf Meinert,,,,,,,,,,"7 Akte, 2853 m (2886 m vor Zensur)Format: 35mm, 1:1.33","35mm, 1:1.33","s/w, stumm",,
Es blasen die Trompeten,https://www.filmportal.de/film/es-blasen-die-trompeten_b847bb01519a4dc6abaf5dc3246a54b0,Spielfilm,1926,Deutschland,,,Karl Görge,,"Bruno Kastner, Hugo Fischer-Köppe, Eddie F. Seefeld, Hans Albers, Erich Kaiser-Titz, Anita Dorris, Fritz Spira, Karl Elzer",,,,Friedrich Stein,,,,,Alfred Hansen,,,,,,,,,,,,,Carl Boese,,,,,,,,,,,"35mm, 1:1,33","s/w, ohne Ton",,
Die Fahrt ins Abenteuer,https://www.filmportal.de/film/die-fahrt-ins-abenteuer_e3126de673884049900bbd349a0b17fe,Spielfilm,1926,Deutschland,,,Rudi Feld,,"Ossi Oswalda: Ossi Bondy, Willy Fritsch: Adam Bondy, ihr Bruder, Gräfin Agnes Esterhazy: Eva Frieson, Lydia Potechinaihre Mutter, Warwick Ward: F. W. Erler, Schriftsteller, Adolphe Engers: Bobby, Julius von Szöreghy",,,,"Curt J. Braun, Robert Liebmann (Bearbeitung)",,,,,Curt Courant,,,,,,"Ernö Rapée (Kino-Musik, Musikalische Gesamtleitung)",,,,Sokal-Film Gmb: H (Berlin),,,Max Mack,,,,,,,,,,,"35mm, 1:1,33","s/w, stumm",,
Die Fahrt ins Glück,https://www.filmportal.de/film/die-fahrt-ins-glueck_1874838033984e499e8fc22b23334bee,Spielfilm,1926,Deutschland,,,Jacek Rotmil,,"Maly Delschaft, Maria Zelenka, Karl Harbacher, Heinz Ludwig",,,,Hans Felsing,,,,,Gotthardt Wolf,,,,,,,,,,Georg Enders-Film Gmb: H (Berlin),,,Heinrich Lisson,,,,,,,,,,,,,,
Falsche Scham,https://www.filmportal.de/film/falsche-scham_3fbc1b35b4624404adf112fb55a8619a,Spielfilm,1926,Deutschland,,,Gustav Hennig,,"Willy Kroschky1. Gymnasiast, Werner Padlowsky2. Gymnasiast, Arthur Kronburger: Vortragender Arzt, Rudolf Biebrach: Sanitätsrat, Eric Cordell: Der Vater, Niuta Helling: Die Mutter, Karin Svedenberg: Amme, Olaf Storm: Student, Richard Wirth: Bauer, Frida Richard: Bäuerin, Erra Bognar: Deren Nichte, Ulrich Bettac: Stadtreisender",,,,"Nicholas Kaufmann, Curt Thomalla",,,,,"Max Brinck, Willibald Gaebel",,,,,,,,,,Universum Film AG (Ufa) - Kulturabteilung (Berlin),,,Rudolf Biebrach,,,,,,,,,,"5 Akte, 2240 m","35mm, 1:1.33","s/w, stumm",,"Zensur (DE): 31.01.1927, O.00062, Genehmigt"
Familie Schimeck (Wiener Herzen),https://www.filmportal.de/film/familie-schimeck-wiener-herzen_687e68f7117a47718b3b3697bc1d99f5,Spielfilm,1926,Deutschland,,,Jacek Rotmil,,"Livio C. Pavanelli: Industrieller 	Franz Kaltenbach, Olga Tschechowa: Franz' Frau Olga, Lydia Potechina: Kaltenbachs Schwiegermutter, Ernst Rückert: Dragoner-Leutnant, Max Hansen: K. K. Kadett, Hans Wallner: K. K. Feldwebel, Paul Morgan: Vormundschaftsrichter, Hermann Picha: Nepomuk Zavadil, Margarete Kupfer: Tischlerswitwe Frau Schimel, Xenia Desni: Lisl, Illo Gutschwager: Willi, Karl Dehnert: Sohn Franzl, Wilhelm Dieterle: Tischlergeselle  		Josef Baumann, Fritz Greiner: Chauffeur",,,,Alfred Halm,,,,,Carl Drews,,,Rudolf Dworsky,,,Felix Bartsch (Kino-Musik),,,,Aafa-Film AG (Berlin),,Rudolf Dworsky,Alfred Halm,,,,,,,,,,"7 Akte, 2352 m, 85 min",35mm,Ton,,"Zensur (DE): 18.03.1926, Jugendverbot"
Faust,https://www.filmportal.de/film/faust_cff7c3b9e2fa42808ca1aa64b803765f,Spielfilm,1926,Deutschland,,,"Robert Herlth, Walter Röhrig, Arno Richter (Assistenz)",,"Gösta Ekman Sr.Faust, Emil Jannings: Mephisto, Camilla Horn: Gretchen, Frida Richard: Gretchens Mutter, Wilhelm Dieterle: Valentin, Yvette Guilbert: Marthe Schwerdtlein, Eric Barclay: Herzog von Parma, Hanna Ralph: Herzogin von Parma, Werner Fuetterer: Erzengel Gabriel, Hans Brausewetter: Bauernbursche, Lothar Müthel: Mönch, Hans Rameau, Hertha von Walther, Emmy Wyda",,,,Hans Kyser,,,,,Carl Hoffmann,"Erich Grohmann, Charles Rosher (Hospitanz)","Robert Herlth, Walter Röhrig, Georges Annenkov (Assistenz)",,,Waldemar Jabs,"Werner Richard Heymann (Bei der Uraufführung), Rolf Unkel (1976. ZDF), Wolfgang Dauner (1976. ZDF), Javier Pérez de Azpeitia (Digitalisierte Fassung (basierend auf Paul Hensel) )",,Artur Guttmann (Ufa-Orchester - Bei der Uraufführung),"Richard Wagner (Motive), Richard Strauß (Motive)",Universum-Film AG (UFA) (Berlin),,Erich Pommer,F. W. Murnau,Hans Rameau,"Robert Basilice, Meyer",,,Hans Natge,,,"Johann Wolfgang von Goethe (Bühnenstück ""Faust""), Christopher Marlowe (Bühnenstück), Ludwig Berger (Manuskript ""Das verlorene Paradies"")",,"7 Akte, 2484 m","35mm, 1:1,33","s/w, stumm","Voraufführung (DE): 26.08.1926, Berlin [Zwischentitel in Versform von Gerhard Hauptmann]",
Fedora (Frauenliebe - Frauenhaß),https://www.filmportal.de/film/fedora-frauenliebe-frauenhass_969822113cfb45cf96481ff205825043,Spielfilm,1926,Deutschland,,,Artur Günther,,"Lee Parry: Fedora, Anita Dorris, Alfons Fryland, Oskar Marion, Maria Forescu, Erich Kaiser-Titz, Nikolai Malikoff, Frida Richard, Eduard von Winterstein",,,,Jean Manoussi,,,,,"Willibald Gaebel, Theodor Sparkuhl, Otto Tober",,,,,,,,,,Maxim-Film Ges. Ebner & Co (Berlin),,,Jean Manoussi,,,,,,,,"Victorien Sardou (Bühnenstück ""Fedora"")",,"6 Akte, 2133 m","35mm, 1:1,33","s/w, ohne Ton",,
Der Feldherrnhügel,https://www.filmportal.de/film/der-feldherrnhuegel_fec578b9246a45b1a45d6c29ce7a6d4e,Spielfilm,1926,Deutschland/Österreich,,,,,"Harry Liedtke: Rittmeister Jennewein, Olga Tschechowa: Gräfin Landieren, Maria Minzenti: Komtesse Lilly, Robert Valberg: Erzherzog, Alexander Roda-Roda: Korpskommandant, Fritz Schrecker: Regimentsarzt, Hansi Niese: Frau Oberst von Leukfeld, Karl Forest: Feldmarschalleutnant, Hans Moser: Regimentsschneider, Hans Marr, Hans Junkermann, Mizzi Zwerenz, Géza L. Weiss, Lupu Pick, Hugo Werner-Kahle",,,,Robert Liebmann,,,,,,,,,,,,,,,Greenbaum-Film Gmb: H (Berlin),,,"Erich Schönfelder, Hans Otto Löwenstein",,,,,,,,"Alexander Roda-Roda (Lustspiel), Carl Rössler (Lustspiel)",,,,,,
