Titel,Link,Genre,Jahr,Land,Aufnahmeleitung,Bauausführung,Bauten,Choreografie,Darsteller,Dialoge,Dramaturgie,Dreharbeiten,Drehbuch,Erstverleih,Garderobe,Herstellungsleitung,Idee,Kamera,Kamera-Assistenz,Kostüme,KünstlerischeOberleitung,Liedtexte,Maske,Musik,Musik-Ausführung,MusikalischeLeitung,MusikalischeVorlage,Produktionsfirma,Produktionsleitung,Produzent,Regie,Regie-Assistenz,Requisite,Schnitt,Script,Standfotos,Supervision,Ton,Vorlage,im Auftrag von,Länge,Format,Bild/Ton,Aufführung,Prüfung/Zensur
Die Reiter von Deutsch-Ostafrika,https://www.filmportal.de/film/die-reiter-von-deutsch-ostafrika_b977cd5251d6499fb4e05f11ea488764,Spielfilm,1934,Deutschland,"Arno Winckler, Günther Regenberg",,"Robert A. Dietrich, Bruno Lutz",,"Sepp Rist: Deutscher Farmer Peter Hellhoff, später Hauptmann der Reserve, Ilse Stobrawa: Gerda, spätere Frau Hellhoff, Peter Voss: Englischer Farmer Robert Cresswell, später Captain, Ludwig Gerner: Hellhoffs Assistent Lossow, später Leutnant, Rudolf Klicks: Hellhoffs Volontär Wilm Klix, Georg Heinrich Schnell: Colonel Black, Arthur Reinhardt: Safari-Führer Charles Rallis, Emine Zehra Zinser: Hellhoffs Dienerin Milini, Louis Brody: Hellhoffs Aufseher Hamissi, später Askari, Mohamed Husen: Signalschüler Mustapha, Gregor Kotto: Hellhofs Boy Selemani, Vivigenz Eickstedt: Englischer Offizier, Ernst Rückert, Erwin Fichtner, Adolf Fischer, Raffles Bill, Herbert Ebel, Wilhelm H. König",,Wilhelm Stöppler (Chefdramaturg),,Marie-Louise Droop,,,,,Emil Schünemann,Bernhard Hellmund,,,,,Herbert Windt,,,,Terra-Film AG (Berlin) (Herstellungsgruppe Walter Zeiske),Walter Zeiske,,Herbert Selpin,,,Lena Neumann,,Kurt Wunsch,,Fritz Seeger,"Marie-Louise Droop (Roman ""Kwa heri"")",,"2206 m, 81 min","35mm, 1:1,37","s/w, Tobis-Klangfilm",,"Zensur (DE): 19.12.1939, Verbot"
Rêve éternel,https://www.filmportal.de/film/reve-eternel_33c6e43aa2164d63ac045743000c1515,Spielfilm,1934,Deutschland/Frankreich,,,"Werner Schlichting, Robert Herlth",,"Sepp Rist: Jacques Balmat, Brigitte Horney: Marie, Ernst Petersen: Paccard, Jeanne de Carol: Maries Mutter, Georges Colin: Maries Vater, Klaus Pohl: Balmats Vater, Pierre Piérade: Dorfbewohner, Pierre Provins: Kommandant, Wilhelm Kaiser-Heyl: Professor Saussure",,,,Arnold Fanck,,"Margarete Scholz, Willi Schlick",,,"Richard Angst, Kurt Neubert",Fritz von Friedl,,,,Paul Dannenberg,Giuseppe Becce,,Willy Schmidt-Gentner,,Cine-Allianz Tonfilm Gmb: H (Berlin),Fritz Klotzsch,"Arnold Pressburger, Gregor Rabinowitsch","Arnold Fanck, Henri Chomette",Herbert B. Fredersdorf,"Erich Düring, Karl Mühlberger",,,,,,,,78 min,"35mm, 1:1.33","s/w, Tobis-Klangfilm",,
Rosen aus dem Süden,https://www.filmportal.de/film/rosen-aus-dem-sueden_34132a37c1364a4d867ebf602197997c,Spielfilm,1934,Deutschland,Hans Tost,,"Erich Zander, Willi Depenau",,"Paul Hörbiger: Johann Strauß, Hugo Werner-Kahle: Johannes Brahms, Oscar Sabo: Gustav Mödlinger, Weingroßhändler, Ekkehard Arendt: Toni, sein Sohn, Olga Limburg: Sophie Mödlinger, Oskar Sima: Eduard Weingruber, Oberkellner, Gretl Theimer: Mizzi, seine Tochter, Roszi Csikos: Roszi, Carl Ehrhardt-Hardt: Poldi Wambacher, Hans Junkermann: Generalkonsul Füßli, Hugo Glink: Graf Lichtenstein, Emil Birron: Baron von Stessel, Elisabeth von Rüts: Baronin, Hans Hermann SchaufußHerr Krause, Johanna Ewaldseine Frau, Otto Sauter-Sarto: Peppi, ein Pratersänger, Henry Lorenzen: Tanzmeister, Paula Denk, Kurt Felden, Arthur Hell, Theodor Hieber, Hans Sanden",,,,"Max Wallner, Hans Vietzke",,Luise Lehmann,,,Willy Winterstein,,,,Charles Amberg,"Carl Eduard Schulz, Charlotte Pfefferkorn",Ernst Erich Buder,,Ernst Erich Buder,Johann Strauß jr. (Kompositionen),Schulz & Wuellner Filmfabrikation u. Vertriebs Gmb: H (Berlin),,"Karl Schulz, Robert Wuellner, Erich Schicker",Walter Janssen,Günther Rennert,"Alfred Schütz, Ernst Thege",Ludolf Grisebach,,Kurt Wunsch,,Walter Rühland,Johann Strauß jr. (Kompositionen),,,,,,
Der rote Tod von Riga,https://www.filmportal.de/film/der-rote-tod-von-riga_a88928f5acd34979ba690c878e53a528,Spielfilm,1934,Deutschland,,,,,,,,,Gerhard Menzel,,,,,,,,,,,,,,,,,,Paul Wegener,,,,,,,,,,,"35mm, 1:1,33",,,
Schach der Eva,https://www.filmportal.de/film/schach-der-eva_87753cf3d0a441b2b67805b68179a2fa,Spielfilm,1934,Deutschland,,,,,"Ludwig Schmid-Wildy: Hampl, Erna Jaus: Hilde, Hedda Björnson: Gabriele, Hansi Thoms: Franzl, Hans Fitz: Professor Kernlinger, Anton Dietl: Kanitzer, Heinz Evelt: Der Dichter",,,,,,,,,,,,,,,,,,,,,,Ludwig Schmid-Wildy,,,,,,,,Julius Pohl (Bühnenstück »Schach der Eva« von 1930),,"1977 m, 72 min","35mm, 1:1,33","s/w, Tobis-Klangfilm","Uraufführung (DE): 19.08.1934, München",
Schloß Hubertus,https://www.filmportal.de/film/schloss-hubertus_9005e6c9aef84caf80e7948a5c027281,Spielfilm,1934,Deutschland,,,Carl Ludwig Kirmse,,"Hans Schlenck: Maler Hans Forbeck, Friedrich Ulmer: Graf Egge, Hansi Knoteck: Kitty, Herta Worell: Mali, Paul Richter: Jäger Franz, Hans Adalbert Schlettow: Jäger Schipper, Arthur Schröder: Tassilo, Margarethe Parbs: Fräulein von Kleesberg, Viktor Gehring: Wilderer Bruckner, Grete Roman: Anna Herwegh",,,,"Willy Rath, Peter Ostermayr",,,Alfred Zeisler,,"Karl Attenberger, Peter Haller",,,,Richard Busch,,Franz R. Friedl,,Franz R. Friedl,,Dialog-Film Gmb: H Peter Ostermayr (Berlin),,Peter Ostermayr,Hans Deppe,Paul May,,Paul May,,,,Hermann Fritzsching,Ludwig Ganghofer (Roman »Schloß Hubertus« (1895)),,"2403 m, 88 min","35mm, 1:1,33","s/w, Tobis-Klangfilm",,
"Schön ist es, verliebt zu sein",https://www.filmportal.de/film/schoen-ist-es-verliebt-zu-sein_3b622f117e23437b9d7338ea4b2318bb,Spielfilm,1934,Deutschland,,,Heinrich Richter,,"Herbert Ernst Groh: Carl, Theaterarbeiter, Erich Kestin: Otto, sein Freund, Karin Hardt: Else, Blumenverkäuferin, Elsa Wagner: Frau Polke, Inhaberin eines Blumengeschäfts, Ernst Dumcke: Kammersänger Larsen, Erika Glässner: Julie, seine Frau, Ralph Arthur Roberts: Schrumpf, sein Sekretär, Theo Lingen: Oberkellner im ""Tabarin"", Dinah Grace: Solotänzerin, Jakob Tiedtke: Vereinspräsident, Walter Steinbeck: Intendant der Oper, Heinz Berghaussingender Polizist, Bert Schmidt-Moris: Boy in der Bar",,,,Jan Fethke,,Otto Zander,,,Georg Krause,Ewald Sudrow,,,Hans Forge,"Richard Timm, Carl Eduard Schulz",Willy Engel-Berger,,Paul Hühn,Giuseppe Verdi (Kompositionen),Gnom-Tonfilm Gmb: H (Berlin),Hans Wolf,Jacob Brodsky,Walter Janssen,Georg Roethe,"Otto Karge, Fritz Tietsch",Wolfgang Wehrum,,Walter Weisse,,Erich Lange,Giuseppe Verdi (Kompositionen),,,,,,
Der Schrecken vom Heidekrug,https://www.filmportal.de/film/der-schrecken-vom-heidekrug_44996cbd30204ce7a6796b52138e36d2,Spielfilm,1934,Deutschland,,,Otto Gülstorff,,"Sabine Peters: Baronin Leutkirch, Oskar Sima: Professor Hans Rohde, Arzt, Ralph Arthur Roberts: Kurt Störmer, Rechtsanwalt, Paul Beckers: Max Hasemann, Bäckermeister, Ursula Grabley: Hedi, seine Tochter, Fritz Servos: Köbicke, sein Freund, Gerhard Dammann: Kühnert, Wirt vom Heidekrug, Ida Perry: Lina, seine Frau, Friedl Hanses: Guste, beider Tochter, Hugo Fischer-Köppe: Fritz, Menagerieangestellter, Ernst Behmer: Landbriefträger, Max Wilmsen: Gutsinspektor",,,,Walter Wassermann,,,,,Georg Bruckbauer,Hugo Schott,,,,"Frieda Lehmann, Bruno Heckmann",Gerhard Winkler,,,,Aco-Film Gmb: H (Berlin),Gustav Althoff,Gustav Althoff,Carl Boese,Günther Regenberg,Max Balzer,Hildegard Grebner,,,,Bruno Suckau,,,,,,,
Schützenkönig wird der Felix,https://www.filmportal.de/film/schuetzenkoenig-wird-der-felix_3ad11e26461a47ff992e0aca3857b626,Spielfilm,1934,Deutschland,,,"Robert A. Dietrich, Bruno Latz",,"Rudolf Platte: Felix Kaminski, Vertreter, Jakob Tiedtke: Postmeister Passerow, Ursula Grabley: Lilli Passerow, seine Nichte, Paul Heidemann: Julius Zehnschock, Firmenchef, Hans Hermann SchaufußEgon Scherzinger, Leonie Duval: Amalie, seine Frau, Oskar Sima: Bürgermeister, Grethe Weiser: Bürgermeisterin, Gaston Briese: Strich, Schlächtermeister, Else Reval: Käthchen, seine Frau, Friedrich Ettel: Mahlke, Gastwirt, Karl Harbacher: Jacubeit, Friseur, Johanna Ewald: Frau Rendantin, Gerhard Dammann: Stadtvater und Schützenhauptmann, Hans Hemes: Meyerhoff, Geschäftsinhaber, Maria Beling, Harry Berber, Karl Falkenberg, Hermann Frick, Kurt Getke, Ida Krill, Hellmuth Passarge, Arthur Reppert, Elisabeth von Rüts, Adi Soltau, Alfred Stratmann, Hella Tornegg",,,,Marc Roland,,"Fritz Pietsch, Anni Loretto",Max G. Hüske,,Bruno Timm,Walter Chmillon,,,Hermann Schulenburg,"Franz Siebert, Richard Timm",Marc Roland,Lewis Ruth,Marc Roland,,Terra-Film AG (Berlin),Max G. Hüske,,Carl Boese,,"Gerhard Busse, Fritz Kelch",Hildegard Grebner,,,,"Eugen Hrich, Fritz Seeger",,,,,,,
Schwarz auf Weiß,https://www.filmportal.de/film/schwarz-auf-weiss_797d3bb6a8494ebb8bf24873937242d7,Spielfilm,1934,Deutschland,,,,,,,,,,,,,,,,,,,,,,,,,,,,,,,,,,,,,,,,,
Der schwarze Walfisch,https://www.filmportal.de/film/der-schwarze-walfisch_34b86ecd971e4ab8a64f5c53d63b814b,Spielfilm,1934,Deutschland,,,"Hans Sohnle, Otto Erdmann",,"Emil Jannings: Peter Petersen, Angela Salloker: Fanny, Max Gülstorff: Pannies, Franz Nicklisch: Martin Petersen, Margarete Kupfer: Frau Jürgens, Käte Haack: Jesefine, Albert Florath: Kapitän, Hans Richter: Heizerjunge, Willy Schaeffers: Bruns, Karl Platenalter Schiffer, Reinhold Gerstenberg: Briefträger",,,,Fritz Wendhausen,,"Alfred Heinke, Anna Hesse",,,Emil Schünemann,Bernhard Hellmund,,,,"Adolf Arnold, Alfred Lehmann",Walter Kollo,,Siegfried Schulz,,Riton-Film Gmb: H (Berlin),Helmut Schreiber,Willi Wolff,Fritz Wendhausen,,"Hans Meerwald, Artur Ott","Alwin Elling, Wolfgang Loë-Bagier",,Fritz Vopel,,Adolf Jansen,,,,,,,
Schwarzer Jäger Johanna,https://www.filmportal.de/film/schwarzer-jaeger-johanna_bd237db7bc29470592a15ccd2099eecd,Spielfilm,1934,Deutschland,"Conny Carstennsen, Kurt Heinz",,"Karl Böhm, Gabriel Pellon",,"Marianne Hoppe: Johanna Luerssen, Paul Hartmann: Major Georg Ludwig Korfes, Gustaf Gründgens: Agent Dr. Frost, Fita Benkhoff: Johannas Tante Philine Melchior, Olga LimburgÄltere Dame, Genia Nikolajewa: Mademoiselle Köttschau, Paul Bildt: Herzog Friedrich Wilhelm von Braunschweig, Anton Pointner: Der Feldmarschall, Margarete Albrecht: Mutter Luerssen, Harry Hardt: Rittmeister Fürst Sulkowski, Erich Fiedler: Leutnant von Hirsewald, Rudolf Biebrach: Oberst von Bernewitz, Karl Dannemann: Volkert Ummen, Friedrich Ettel: General Rewbell, Oskar Sima: Hofrat Zöllner, Jakob Tiedtke: Amtmann Cropp, Angelo Ferrari: Leutnant Péaulier, Gustav Püttjer: Daniel Bielich, Ida Perry: Frau Cropp, Harry Frank: Sohn Caspar Cropp, Gerhard Dammann: Gastwirt Nordmann, Erich Haußmann: Der Graue, Margot Köchlin: Sängerin, Gertrud Wolle: Russische Großfürstin, Raffles Bill: Bote, Wolfgang Staudte: Charge, Hans Albin, Heinz Berghaus, Eduard Bornträger, Fred Immler, Hans Kleebusch, Strenger, Max Mothes, Carl Walther Meyer, Karl Platen, Paul Rehkopf, Hans Ritter, Hans Schneider, Teddy Wulff, Jul. Monkow, Hella Tornegg, Wessling",,,,"Heinrich Oberländer, Heinz Umbehr",,"Fritz Pietsch, Hans Dupke, Anni Loretto",,,Alexander von Lagorio,G. F. Peters,,,,"Alma Timm, Franz Siebert",Winfried Zillig,,,,Terra-Film AG (Berlin) (Herstellungsgruppe Rudolf Fritsch),Rudolf Fritsch,,Johannes Meyer,,"Hans Coelius, Hans Meerwald",Lena Neumann,,,,Hans Grimm,"Georg von der Vring (Roman aus der ""Berliner Zeitung"")",,"8 Akte, 2735 m, 100 min","35mm, 1:1,37","s/w, Tobis-Klangfilm",,
Le secret des Woronzeff,https://www.filmportal.de/film/le-secret-des-woronzeff_0db9f88e58bc4f0ca016b58dcf80723b,Spielfilm,1934,Deutschland,,,"Erich Kettelhut, Max Mellin",,"Brigitte Helm: Diane, Jean Muratle prince Woronzeff / Franz von Naydeck, Madeleine Ozeray: Nadia, Wladimir Sokoloff: Petroff, Pierre Mingandle frère von Naydek, Marguerite Templeytante Adèle, Gaston Dubosc: Oncle Ivan, Jeanne Pierson, Marguerite de Morlaye, Guy Sloux, Charles Redgie, Marc-Hély, Raymond Aimos",André Beucler,,,"Walter Supper, Artur Robison",,,,,"Günther Rittau, Otto Baecker",,,,,,Hans-Otto Borgmann,,Hans-Otto Borgmann,,Universum-Film AG (UFA) (Berlin),,,"Artur Robison, André Beucler",,,,,,,,,Alliance Cinématographique Européenne (A.C.E.) (Paris),,,,,
Sie und die Drei,https://www.filmportal.de/film/sie-und-die-drei_616221906f644617801e940a70f44dde,Spielfilm,1934,Deutschland,,,"Erich Zander, Willi Depenau",,"Hubert von Meyerinck, Harald Paulsen, Charlotte Susa, Hans Söhnker, Walter Steinbeck",,,,Walter Wassermann,,,,,Willy Winterstein,Karl Löb,,,,,,,,,,,,Victor Janson,,,,,,,,,,,,,,
So ein Flegel,https://www.filmportal.de/film/so-ein-flegel_333736b8329a477d98575ace1c46abe8,Spielfilm,1934,Deutschland,,,"Erich Czerwonski, Karl Böhm",,"Heinz Rühmann: Dr. Hans Pfeiffer, Schriftsteller - Erich Pfeiffer, Ellen Frank: Marion Eisenhut, Schauspielerin, Inge Conradi: Ilse Bundschuh, Sekretärin, Maria Seidler: Ihre Mutter, Erwin van Roy: Bürglein, Regisseur, Walter Steinweg: Springer, Schauspieler, Franz Klebusch: Brandl, Schauspieler, Jakob Tiedtke: Rektor Knauer, Annemarie Sörensen: Eva, seine Tochter, Else Bötticher: Frau Knauer, Erika Streithorst: Nora, Oskar Sima: Professor Krey, Franz Weber: Bömmel, Oberlehrer, Karl Platen: Ortel, Pedell, Rudolf Platte: Rettig, Tanzlehrer, Margarete Sachse: Frau Rettig, Gerhard Haselbach: Ackermann, Horst Beck: Luck, Eduard Bornträger: Hitz, Henriette Steinmann: Frau Windscheidt, Evelyn Roberti: Soubrette, Anita Mey: Verehrerin, Rudolf Klicks: Pförtner, Tommy Thomas: Primaner",,,,"Hans Reimann, Robert A. Stemmle",,"Gustav Jäger, Frieda Strahl",,,Carl Drews,Walter Essek,Edward Suhr,,Robert A. Stemmle,"Carl Eduard Schulz, Frieda Lehmann",Harald Böhmelt,,Harald Böhmelt,,Cicero-Film Gmb: H (Berlin),Ernst Garden,Felix Pfitzner,Robert A. Stemmle,Reinhart Steinbicker,Otto Krüerke,Rudolf Schaad,,Karl Lindner,,Hans Grimm,"Heinrich Spoerl (Roman ""Die Feuerzangenbowle"")",,,,,,
So endete eine Liebe,https://www.filmportal.de/film/so-endete-eine-liebe_534e6bb4b1a845a7b4e221794598e5c4,Spielfilm,1934,Deutschland,,,Werner Schlichting,,"Paula Wessely: Erzherzogin Marie-Luise, Willi Forst: Herzog Franz von Modena, Gustaf Gründgens: Metternich, Franz Herterich: Kaiser Franz I., Rose Stradner: Kaiserin Maria Ludovica, Erna Morena: Josephine, Maria Koppenhöfer: Madame Mère, Edwin Jürgensen: Talleyrand, Gustav Waldau: Hofrat, Olga Engl, Annemarie Steinsieck, Toni Tetzlaff, Hertha von Walther, Erich Dunskus, Rudolf Essek, Angelo Ferrari, Hugo Flink, Alfred Gerasch, Josef Peterhans, Leo Peukert, Louis Ralph, Franz W. Schröder-Schrom, Hans Waschatko",,,,"Karl Hartl, Walter Reisch",,,,,Franz Planer,Willy Gerlach,,,,,Franz Grothe,,,,Cine-Allianz Tonfilm Gmb: H (Berlin),Fritz Klotzsch,"Arnold Pressburger, Gregor Rabinowitsch",Karl Hartl,Heinz Helbig,,René Métain,,,,Hans Grimm,,,,,,,
Spiel mit dem Feuer,https://www.filmportal.de/film/spiel-mit-dem-feuer_d812d93e1d024378813656c0754b8f26,Spielfilm,1934,Deutschland,,,"Erich Kettelhut, Max Mellin",,"Paul Hörbiger: Dr. Alfred Kramer, Trude Marlen: Annette Kramer, Elga Brink: Sylvia Bernhardt, Willy Schaeffers: Schriftsteller Gründlich, Horst Birr: Kellner Emil Kummerberg, Ellen Hille: Dienstmädchen Marie, Hilde Krüger: Zofe Helene, Toni Tetzlaff, Ernst Hofmann, Josef Reithofer, Boris Walt, Hans Sternberg, Ernst G. Schiffner",,,,"Ralph Arthur Roberts, Herbert B. Fredersdorf, Roland Schacht",,,,,Fritz Arno Wagner,,,,Erwin Lehnow,,Werner Bochmann,,,,Universum-Film AG (UFA) (Berlin),,,Ralph Arthur Roberts,Herbert B. Fredersdorf,,Hans Wolff,,,,Carlheinz Becker,,,,,,,
Die Sporck'schen Jäger,https://www.filmportal.de/film/die-sporckschen-jaeger_1f2775f1d60c45e4975586673a24dd17,Spielfilm,1934,Deutschland,"Arthur Kiekebusch, Hans Schönmetzler",,Heinrich Richter,,"Fritz Alberti: Oberstleutnant, Werner Schott: Hauptmann von Naugaard, Erich Fiedlervon Fahlenberg, Fritz Genschow: Leutnant von Naugaard, Theodor Loos: Oberförster Rüdiger, Reva Holsey: Tochter Elsbeth, Margarete Kupfer: Mutter Retelsdorf, Rotraut Richter: Tochter Mike, Paul Rehkopf: Eteldorf, Paul Westermeier: Heinrich Krenzow, Ida Perry, Erik Ode, Antonie Jaeckel, Frank Günther, Michael von Newlinski, Max Wilmsen, Franz Klebusch",,,,Bobby E. Lüthge,,,,,Karl Puth,,,Theodor Loos (Künstlerische Leitung),,,Fritz Wenneis,,,,Rolf Randolf-Film Gmb: H (Berlin),,Rolf Randolf,Rolf Randolf,,,Ludolf Grisebach,,,,,Richard Skowronnek,,"2622 m, 95 min","35mm, 1:1,37","s/w, Tobis-Klangfilm",,
Der Springer von Pontresina,https://www.filmportal.de/film/der-springer-von-pontresina_c0684781cb1d4125b68bffc42b771cd3,Spielfilm,1934,Deutschland/Schweiz,"Willi Morrée, Erich Frisch",,"Robert A. Dietrich, Bruno Lutz",,"Sepp Rist: Dr. Uli Boeker, Mannschaftsführer, Vivigenz Eickstedt: Tielko Groots, Eric Helgar: Moritz, Rudolf Klicks: Max, Ludwig Gerner: Karl, Annie Markart: Violett Moore, Friedrich Ettel: Friedrich Holm, Industrieller, Georg Heinrich Schnell: I. P. Moore, Bankier, Henry Lorenzen: Henry W. Macpherson, Sportsmann, Violetts Vetter, Ali Ghito: Marlen, Mannschaftsführerin, Edith Anders: Lies, Katja Bennefeld: Toni, Hilde Maria Rapp-Fidelius: Maria, Walter Rilla: Peter Tonani, Geigenvirtuose, Hans von Petersdorff: Eiskunstläufer, Hilda Rückert: Eiskunstläuferin, Hans Albin: Ein Mitglied der Ski-Mannschaft, Hedy Heyssing: Holms Tochter Ursula, Erna Fentsch: Bertchen",,,,Hans Richter,,,,,"Sepp Allgeier, Richard Angst, Heinz von Jaworsky",Wolf Hart,,,"Günther Schwenn (""Wir wollen Freunde sein fürs ganze Leben!"")",,Will Meisel,,Franz Stolzenwald,,"Terra-Film AG (Berlin), Schweizer-Produktion der Terra-Film AG (Zürich)",Walter Zeiske,"Ralph Scotoni, Karl Schulz, Robert Wuellner",Herbert Selpin,Herbert Maisch,,Lena Neumann,,,,Emil Specht,Hans Richter,,"2612 m, 95 min","35mm, 1:1,37","s/w, Tobis-Klangfilm",,
Der Störenfried,https://www.filmportal.de/film/der-stoerenfried_87a9713ee0b04b84ba5751bb8e9b17c8,Spielfilm,1934,Deutschland,,,Erich Czerwonski,,"Friedel Pisetta, Fita Benkhoff, Georg Alexander, Adele Sandrock, Hugo Schrader, Paul Henckels, Liselotte Schaak, Ines von Taube, Hubert von Meyerinck, Elfriede Jerra",,,,"Philipp Lothar Othello Mayring, Lothar Philipp August Mayring",,,,,Willy Winterstein,,,,,,Hans-Otto Borgmann,,,,Universum-Film AG (UFA) (Berlin),,,Georg Jacoby,,,,,,,,Roderich Benedix (Erzählung),,"1273 m, 47 min","35mm, 1:1,33","s/w, Ton",,
Stoßtrupp 1917,https://www.filmportal.de/film/stosstrupp-1917_d8804b2539e549a1968278301df1a277,Spielfilm,1934,Deutschland,,,,,"Ludwig Schmid-Wildy: Hans Steinbauer, Albert Penzkofer: Der Unteroffizier, Beppo Brem: Girgl, Karl Hanft: Martl, Max Zankl: Heiner, Hans Pössenbacher: Anderl, Heinz Evelt: Max, Ludwig ten Kloot: Der Kompanieführer, Hans Schaudinn: Der Feldwebel, Hans Erich Pfleger: Karl, Georg Emmerling: Gustl, Emil Matousek: Michel, Harry Hertzsch: Der Leutnant, Matthias Olschinsky: Der Genaral, Leopold Kerscher: Der Funker",,,,"Franz Adam, Marian Kolb, Hans Zöberlein",,,,,"Franz Bertl Seyr, Josef Wirsching, Carl Dittmann, Karl Hasselmann, Ludwig Zahn","Gustav Weiss, Karl Buhlmann",,,,,,,,,Arya-Film Gmb: H (München - Berlin),Marian Kolb,"Franz Adam, Alfred Oberlindober, Franz Geretshauser","Hans Zöberlein, Ludwig Schmid-Wildy",,,"Else Baum, Martha Dübber, Carl Otto Bartning",,,,"Eugen Hrich, Siegfried Schulz",Hans Zöberlein (Buch: Der Glaube an Deutschland),,7 Akte,35mm,"s/w, Tobis-Klangfilm",,
Tambour battant,https://www.filmportal.de/film/tambour-battant_2c16b0a1ef45435a9c60b8026af1ce17,Spielfilm,1934,Deutschland,,,"Erich Kettelhut, Max Mellin",,"Georges Rigaud: Prinz Leopold von Anhalt-Dessau, Françoise Rosay: Fürstin-Mutter, Josseline Gael: Anneliese, Charles Martinelli: Kaiser Lepold I., Félix Oudart: Graf de Chalisac, Lucien Carol: Sergeant, Robert Lepers: Der vertriebene Prätendent, Raymond Rognoni, Paul Ollivier, Maurice Rémy, André Nicolle, Henri Chomette, Hubert von Meyerinck, Edouard Hamel, Renée Bel",,,,"Philipp Lothar Othello Mayring, Lothar Philipp August Mayring, Bobby E. Lüthge",,"Fritz Schilling, Elisabeth Kuhn",Max Pfeiffer,,Friedl Behn-Grund,Franz von Klepacki,Ilse Fehling,,,Waldemar Jabs,Eduard Künneke,,Franz Marszalek,,Universum-Film AG (UFA) (Berlin),,,"Artur Robison, André Beucler",Herbert B. Fredersdorf,"Heinz Hegel, Arthur Schwandt",Herbert B. Fredersdorf,,Willi Klitzke,Raoul Ploquin,Carlheinz Becker,,Alliance Cinématographique Européenne (A.C.E.) (Paris),,,,,
Die Töchter Ihrer Exzellenz,https://www.filmportal.de/film/die-toechter-ihrer-exzellenz_a390439f09fd4ce5b6c3cea570d9381d,Spielfilm,1934,Deutschland,Otto Lehmann,,"Erich Kettelhut, Max Mellin",,"Käthe von Nagy: Gerti von Petrin, Willy Fritsch: Graf Conrad Marenzi Jr., Hansi Niese: Witwe Henriette von Petrin, genannt ""Die Exzellenz"", Adele Sandrock: Gräfin Virginia Marenzi, Dagny Servaes: Gertis Schwester Leonie, Hans Moser: Leonies Ehemann Anton, Gustav Waldau: Graf Conrad Marenzi Sr., Lizzi Holzschuh: Verkäuferin Mizzi, Fritz Imhoff: Geschäftsinhaber Toniczek, Tine Schneider: Angestellte Rosl, Julius Brandt: Marenzis Diener Leopold, Anton Pointner: Portier, Hans Joachim SchaufußGustl, Willi Schur: Kunde, Hans Adolfi, Betty Sedlmayr, Ewald Wenck, Karl Meixner?, Walter Simlinger?",,,,Emil Burri,,"Max König, Senta Schlick",Günther Stapenhorst,,Werner Brandes,Karl Drömmer,,,,"Waldemar Jabs, Wilhelm Weber",Albert Fischer,,Albert Fischer,Johann Strauß jr. (Walzermelodien),Universum-Film AG (UFA) (Berlin) (Herstellungsgruppe Günther Stapenhorst),Erich von Neusser,,Reinhold Schünzel,Kurt Hoffmann,"Erich Düring, Karl Mühlberger",Willy Zeyn jun.,,Horst von Harbou,,Fritz Thiery,"Leslie Bush-Fekete (Bühnenstück ""A méltóságos asszony trafikja"" - ""Die kleine Trafik"")",,"2576 m, 95 min","35mm, 1:1,37","s/w, Tobis-Klangfilm",,
Toi que j'adore,https://www.filmportal.de/film/toi-que-jadore_e0f5d361f02d431ba505d728496ae0dc,Spielfilm,1934,Deutschland/Frankreich,,,"Emil Hasler, Artur Schwarz",,"Jean Murat: Jean Forestier, Edwige Feuillère: Jaqueline Boulanger, Violaine Barry: Suzanne, Henry Houry: Baron du Froicq, Georges Saillard: Félix, Charles Dechamps: Henri Rodenberg, Angelo Ferrari, Renée Bel, Georgette Delnarès, Pierre Sergeol, Pierre Juvenet, Pierre Piérade, Frank O'Neill, Targol, Imac, Denoix",Albert Valentin,,,Walter Jerven,,Franz Hübele,,,Bruno Mondi,Ernst W. Fiedler,,,,"Willi Grabow, Oskar Georgi",Franz Grothe,Ilja Livschakoff (Orchester),Franz Grothe,,"Boston-Films Company mb: H (Berlin), Films Sonores Tobis (Paris)",Robert Leistenschneider,Fritz Fromm,"Géza von Bolváry, Albert Valentin",Walther von Ostmann,"Otto Karge, Eduard Brenner",Hermann Haller,,Rudolf Brix,,Erich Lange,,,,"35mm, 1:1.33","s/w, Tobis-Klangfilm",,
Turandot. Princesse de Chine,https://www.filmportal.de/film/turandot-princesse-de-chine_c4909296d93449718803db9fefc9f6c9,Spielfilm,1934,Deutschland,Ernst Körner,,"Robert Herlth, Walter Röhrig",,"Käthe von Nagy: Prinzessin Turandot, Pierre Blanchar: Vogelhändler Kalaf, Marcel Dalio: Hippolyte, Monette Dinay: Mien-Li, Jean Sinoël: Der Kaiser, Marfa Dhervilly: Die Kaiserin, José Noguéro: Der Prinz von Samarkand, Raymond Rognoni: Der Obsthändler, André Berley: Der Oberrichter, Katia Lova, Philippe Richard, Julien Carette, Edouard Hamel",Serge Véber,,,Thea von Harbou,,"Fritz Schilling, Max König",Günther Stapenhorst,,Fritz Arno Wagner,"Werner Krien, Igor Oberberg",,,Bruno Balz,"Wilhelm Weber, Adolf Arnold, Emil Neumann, Maria Jamitzky",Franz Doelle,,Franz Doelle,,Universum-Film AG (UFA) (Berlin),,,"Gerhard Lamprecht, Serge Véber",,"Erich Düring, Karl Mühlberger",,,Horst von Harbou,Raoul Ploquin,Dr. Fritz Seidel,"Graf Carlo Gozzi (Bühnenstück), Friedrich Schiller (Bühnenstück)",Alliance Cinématographique Européenne (A.C.E.) (Paris),,,,,
Um das Menschenrecht. Ein Filmwerk aus der Freikorpszeit,https://www.filmportal.de/film/um-das-menschenrecht-ein-filmwerk-aus-der-freikorpszeit_4c43f17dd1be4fd9a9bf91b851fe6157,Spielfilm,1934,Deutschland,,,,,,,,,,,,,,,,,Ludwig Schmid-Wildy,,,,,,,,,,Hans Zöberlein,,,,,,,,,,,,,,
Un de la montagne,https://www.filmportal.de/film/un-de-la-montagne_1f7ff96bb2d041ba9c21e86e31800568,Spielfilm,1934,Deutschland/Schweiz/Frankreich,,,Max Seefelder,,"Gustav Diessl: Jacques Burkhardt, Simone Bourday: Monique Ander, Beni Führer: Guy Ander, Louis Gauthier, Stephan Blötzer: Stéphane Malten, Léon Bélières: Malten, Maximilienne: Mme Malten, Rolf Pinegger, Jean Toulout, Thekla Ahrens: Marie, Maurice de Vanonge, Werner Düby, Jacques de Féraudy: Dr. Reymond, David Zogg: Théodore, Paul Clerget, Lucien Blondeau, Marcel Vibert, Hildegard Amon, Raymond Leboursier",André Legrand,,,"Anton Kutter, August Kern",,"Hermann Dor, Dorothea Saumweber",,,"Paul Portier, Josef Koch, Otto Martini, Richard Angst (Nachaufnahmen)",,Strahm-Hügli (Bern),,,Max Rauffer,"Jacques Dallin, Peter Kreuder Jr., Hilmar Georgi",,,,"Genossenschaft Filmdienst (GEFI) (Bern), Exclusivités Giovanni Seyta (Paris), Bavaria Film AG (München-Geiselgasteig)",,,"Serge de Poligny, René Le Hénaff",,,"René Le Hénaff, Raymond Leboursier",Ottilie Favini,"Josef M. Rubner, Walter Schweizer",,"Karl-Albert Keller, Itor",,,,"35mm, 1:1.33","s/w, Tobis-Klangfilm",,
