Titel,Link,Genre,Jahr,Land,Aufnahmeleitung,Bauausführung,Bauten,Choreografie,Darsteller,Dialoge,Dramaturgie,Dreharbeiten,Drehbuch,Erstverleih,Garderobe,Herstellungsleitung,Idee,Kamera,Kamera-Assistenz,Kostüme,KünstlerischeOberleitung,Liedtexte,Maske,Musik,Musik-Ausführung,MusikalischeLeitung,MusikalischeVorlage,Produktionsfirma,Produktionsleitung,Produzent,Regie,Regie-Assistenz,Requisite,Schnitt,Script,Standfotos,Supervision,Ton,Vorlage,im Auftrag von,Länge,Format,Bild/Ton,Aufführung,Prüfung/Zensur
Das goldene Kalb,https://www.filmportal.de/film/das-goldene-kalb_8dc6d737f5e44c41937e923817ef9282,Spielfilm,1924,Deutschland,,,"Hans Sohnle, Otto Erdmann",,"Henny Porten: Magdalena, Albert Steinrück: Floris, Olga Engl: Frau Grahl, Angelo Ferrari: Nikolaus, Alfred Schreiber: Fiber, Colette Brettel: Judith, Johannes Riemann: Paulus, Ossip Runitsch: Leibgardist, Friedrich Kühne: Auditor, Edgar Klitsch: Waisenvater, Rosa Valetti",,,,Peter Paul Felner,,,,,"Gustave Preiß, Mutz Greenbaum",,,,,,,,,,Westi-Film Gmb: H (Berlin),Julius Wachtel,,"Peter Paul Brauer, Peter Paul Felner",,,,,Reinhold Draber,,,"Ferenc Herczeg (Roman ""Die beiden Leben der Magdalena"")",,,,,,
Die Goldsucher,https://www.filmportal.de/film/die-goldsucher_7e7bee40f5ee4688ae9808f6cf4b802d,Spielfilm,1924,Deutschland,,,,,,,,,,,,,,,,,,,,,,,,,,,,,,,,,,,,,,,,,
"Gott, Mensch und Teufel",https://www.filmportal.de/film/gott-mensch-und-teufel_609b4fe9856a4153a47adf8f0fb2de22,Spielfilm,1924,Deutschland,,,,,"Eduard von Winterstein: Ol Sörensen, Sibyl Smolowa: Senta, seine Tochter, Hans Adalbert Schlettowder Teufel",,,,,,,,,,,,Oskar Schubert-Stevens,,,,,,,,,,Oskar Schubert-Stevens (Künstlerische Leitung),,,,,,,,,,,,,,
Gräfin Donelli,https://www.filmportal.de/film/graefin-donelli_4afcc0f480ba4314810d4f21f7fe0f95,Spielfilm,1924,Deutschland,,,Hermann Warm,,"Henny Porten: Mathilde Donelli, Paul Hansen: Graf Donelli, Friedrich Kayßler: Graf Bergheim, ihr Oheim, Eberhard Leithoff: Hellwig, dessen Privatsekretär, Ferdinand von Alten: Baron von Trachwitz, Lantelme Durrer, Karl Etlinger, Hans Brausewetter",,,,Hans Kyser,,,,,Guido Seeber,,,,,,,,,,Maxim-Film Ges. Ebner & Co (Berlin),,,G. W. Pabst,Mark Sorkin,,,,,,,,,,,,,
Graf Chagron,https://www.filmportal.de/film/graf-chagron_7575ea67500d488dbe2839496b9448f2,Spielfilm,1924,Deutschland,,,Ernst Heinrich,,"Paul Barleben, Edith Romanoff, Peter Esser, Fritz Servos, Mathilde Windslar, Josef Lacquer, Willi Barchardt, Karl Scheueren, Theodor Kipler, Werner Heuser, Klaus Meyer, J. v. d. Gracht",,,,"Hans Müller-Schlösser, Hansjürgen Völcker",,,,,László Schäffer,,,,,,,,,,,,,Hansjürgen Völcker,,,,,,,,"Honoré de Balzac (Erzählung ""Colonel Chabert"")",,4 Akte,,,,
Graf Kostja,https://www.filmportal.de/film/graf-kostja_0b86786cbe824633b547beba1de5f6d8,Spielfilm,1924,Frankreich/Deutschland,,,,,"Conrad Veidt: Comte Kostia, Genica Athanasiou: Stéphane, Claire Darcas: Comtesse Kostia, André Nox: Vladimir Paulitch, Pierre Daltour: Gilbert de Saville, Paul Pauley: Pope Alexis, Henri Desmarets: Ivan, Florence Talma: Mme Lerins, Farney: Fritz, Roby Guichard, Louise Barthe, Yvette Langlais",,,,,,,,,"Georges Lukas, Lucien Bellavoine",,,,,,,,,,"Westi-Film Gmb: H (Berlin), Art et Cinégraphie (Paris)",,,Jacques-Robert,,,,,,,,Victor Cherbuliez (Roman),,,"35mm, 1:1,33","s/w, stumm",,
Guillotine,https://www.filmportal.de/film/guillotine_638df79631104d56ada8074ae7fc8d66,Spielfilm,1924,Deutschland,,,August Rinaldi,,"Marcella Albani: Marie und die Mutter, Hans Albers: Gaston Brieux, Andja Zimowa: Alice, Willy Fritsch: Paul, Leopold von Ledebur: Cartier, Bankier, Eduard von Winterstein: Prokurist Laroche, Georg John, Bruno Ziener",,,,,,,,,Achille Nani,,,,,,,,,,Albani-Film Gmb: H (Berlin),,,Guido Schamberg,,,,,,,,,,,"35mm, 1:1,33","s/w, ohne Ton",,
Harry & Co.,https://www.filmportal.de/film/harry-co_ca2fdb9bc81a4be8966c474ff0ff8cc6,Spielfilm,1924,Deutschland,,,Hermann Krehan,,"Harry Camin: Harry, das Kind, Adolf Edgar Licho: Herr Menzel, Harrys Onkel, Senta Söneland: Marie, Dienstmädchen, Herbert Paulmüller: Hauswirt",,,,Melitta Camin,,,,,Max Lutze,,,,,,,,,,Melitta-Film-Gesellschaft (Berlin),,,Melitta Camin,,,,,,,,,,,,,,
Harry Hills Jagd auf den Tod [Teil 1],https://www.filmportal.de/film/harry-hills-jagd-auf-den-tod-teil-1_c348daed0eec4a91a8ee20e492634897,Spielfilm,1924,Deutschland,,,,,"Valy Arnheim: Harry Hill, Marga Lindt, Aruth Wartan, Georg John, Kurt Lilien, Sybil Morel, Walter Formes",,,,Willy Rath,,,,,"Otto Kanturek, Josef Dietze",,,Valy Arnheim,,,,,,,Valy Arnheim-Film Gmb: H (Berlin),,,"Willy Rath, Lorenz Bätz",,,,,,,,,,"5 Akte, 1547 m","35mm, 1:1,33","s/w, ohne Ton",,
Harry Hills Jagd auf den Tod [Teil 2],https://www.filmportal.de/film/harry-hills-jagd-auf-den-tod-teil-2_e957b68dc4cf48e686710c9d61dcad59,Spielfilm,1924,Deutschland,,,,,"Valy Arnheim: Harry Hill, Marga Lindt, Aruth Wartan, Georg John, Kurt Lilien, Sybil Morel",,,,Willy Rath,,,,,"Otto Kanturek, Josef Dietze",,,Valy Arnheim,,,,,,,Valy Arnheim-Film Gmb: H (Berlin),,,"Willy Rath, Lorenz Bätz",,,,,,,,,,"5 Akte, 1742 m","35mm, 1:1,33","s/w, ohne Ton",,
Das Haus am Meer,https://www.filmportal.de/film/das-haus-am-meer_bde279e649fd4d6e8c6a18db96146083,Spielfilm,1924,Deutschland,,,Kurt Richter,,"Grigori Chmara: Fischer Enrico, Asta Nielsen: Enricos Ehefrau Teresa, Carl Auen: Gino, Alexandra Sorina: Ginos Ehefrau, Albert Steinrück: Werber, Hermann Vallentin: Sergeant, Rudolf del Zopp: Ohm",,,,"Bobby E. Lüthge, Fritz Kaufmann",,,,,"Erich Waschneck, Alfredo Lenci",,,,,,,,,,Mercedes-Film AG (Berlin),,Heinrich Nebenzahl,Fritz Kaufmann,,,,,,,,Stefan Zweig (Bühnenstück),,"5 Akte, 1830 m","35mm, 1:1,33","s/w, stumm",,
Das Haus im Dunkeln,https://www.filmportal.de/film/das-haus-im-dunkeln_15362fbe5d02461bba65a63fbb6a4c97,Spielfilm,1924,Deutschland,,,,,,,,,Ada van Roon,,,,,,,,,,,,,,,,,,Gernot Bock-Stieber,,,,,,,,,,,,,,
Hedda Gabler,https://www.filmportal.de/film/hedda-gabler_b0875e01ca2544c6b5a488e7a719a334,Spielfilm,1924,Deutschland,Willy Herrmann,,Max Frick,,"Paul Morgan: Dr. Jürgen Tesman, Asta Nielsen: Tesmanns Ehefrau Hedda Gabler, Frida Richard: Tante Juliane Tesman, Albert Steinrück: Gerichtsrat Brack, Grigori Chmara: Eilert Lövborg, Käte Haack: Frau Thea Elvsted, Olga Limburg: Rote Diana, Jeanette Bethge: Dienstmächen Berte, Carl Balta",,,,"Rosa Porten, Franz Eckstein",,,,,Franz Stein,,Werner Boehm,,,Arnold Jenssen,,,,,National-Film AG (Berlin),,,Franz Eckstein,,,,,,,,Henrik Ibsen (Bühnenstück),,"6 Akte, 2577 m","35mm, 1:1,33","s/w, stumm",,
Die Heimatlosen,https://www.filmportal.de/film/die-heimatlosen_a894bdb0a1554b75986d66aa23e5d58c,Spielfilm,1924,Deutschland,,,,,"Leontine Kühnberg: Naja, Max Ruhbeck: Viktor Andree, Generaldirektor, Kurt Busch: Axel Hain, sein Neffe, Ernst Pittschau: Oswald Harro, Ingenieur, Heinrich Wessel: Murra, ein alter Zigeuner, Fritz Russ: Johann, Diener bei Andree",,,,,,,,,,,,,,,,,,,,,,Preben J. Rist,,,,,,,,,,,,,,
Helena. 1. Teil: Der Raub der Helena,https://www.filmportal.de/film/helena-1-teil-der-raub-der-helena_688897a36e6a4498bb9963387d5fee07,Spielfilm,1924,Deutschland,,,"Otto Voelckers, Peter Rochelsberg, Berthold Rungers (Entwurf des Trojanischen Pferdes)",,"Edy Darclea: Helena, Hanna Ralph: Andromache, Adele Sandrock: Hekabe, Albert Steinrück: Priamos, Carl de Vogt: Hektor, Albert Bassermann: Aisakos, Carlo Aldini: Achill, Friedrich Ulmer: Menelaos, Karl Wüstenhagen: Agamemnon, Carl LamačPatroklos, Rudolf Meinhardt-Jünger: Thersties, Otto Kronburger: Odysseus, Ferdinand Martini: Agrelaos",,,,Hans Kyser,,,,,"Gustave Preiß, Ewald Daub",,Leo Pasetti,,,,,,,,,,,Manfred Noa,Hans Schönmetzler,,,,,,,,,"5 Akte, 2189 m",,"s/w, stumm",,
Helena. 2. Teil: Der Untergang Trojas,https://www.filmportal.de/film/helena-2-teil-der-untergang-trojas_a86798d9e2b74ea7b3769e202357cb16,Spielfilm,1924,Deutschland,,,"Otto Voelckers, Peter Rochelsberg, Berthold Rungers (Entwurf des Trojanischen Pferdes)",,"Edy Darclea: Helena, Hanna Ralph: Andromache, Adele Sandrock: Hekabe, Albert Steinrück: Priamos, Carl de Vogt: Hektor, Albert Bassermann: Aisakos, Carlo Aldini: Achill, Friedrich Ulmer: Menelaos, Karl Wüstenhagen: Agamemnon, Carl LamačPatroklos, Rudolph Meinhard: Tersites, Otto Kronburger: Ulises, Ferdinand Martini: Agelaos",,,,Hans Kyser,,,,,"Gustave Preiß, Ewald Daub",,Leo Pasetti,,,,,,,,,,,Manfred Noa,,,,,,,,,,"6 Akte, 2904 m",,"s/w, stumm",,
Die Hermannschlacht,https://www.filmportal.de/film/die-hermannschlacht_52b59236df8446948c75677f6a4f4154,Spielfilm,1924,Deutschland,,,"Dr. Hanns Jaquemar, Fritz Kraenke",,"Adolf Bassermann: Segimer, Fürst der Cherusker, Antonie Jaeckel: Alahgund, Segimers zweite Frau, Georg Schmieter: Arminius, Sohn Segimers aus erster Ehe, Mia Pankau: Gunthild, Waisenkind, im Hause Segimers erzogen, Gustav Czimeg: Segestes, neben Segimer Fürst der Cherusker, Annemarie Wisser: Tusnelda, Tochter von Segestes, Gustav Adolf Semler: Segimund, Sohn von Segestes, Hans Mühlhofer: Marobod, Fürst der Markomannen, de Stefano-Vitate: Quintilius Varus, Römischer Statthalter in Germanien, Fred Immler: Ventidius, Römischer Gesandter bei den Cheruskern",,,,Leo König,,,,,Marius Holdt,,J. Bieeker,,,,Dr. Fritz Chlodwig Lange,,,,,,,Leo König,,,,,,,,,,"5 Akte, 1928 m",,,,
Die Herrin von Monbijou,https://www.filmportal.de/film/die-herrin-von-monbijou_333eeaab32a74f40a2dac0e6d379acee,Spielfilm,1924,Deutschland,,,,,"Lya Mara, Hermann Böttcher, Albert Patry, Julia Serda, Ulrich Bettac",,,,Fanny Carlsen,,,,,Mutz Greenbaum,,,,,,,,,,Zelnik-Mara-Film Gmb: H (Berlin),,,Friedrich Zelnik,,,,,,,,,,,,,,
Das Herz der Lilian Thorland,https://www.filmportal.de/film/das-herz-der-lilian-thorland_c32bbd8ceaac4145b01d4267df7972ae,Spielfilm,1924,Deutschland,,,Franz Schroedter,,"Esther Carena, Evi Eva, Hermann Picha, Hermann Vallentin, Oskar Marion, Heinrich Schroth, Karl Falkenberg, Albert Patry, Kurt Brenkendorf, Henri Peters-Arnolds, Charles Lincoln, Dora Bergner",,,,Jane Bess,,,,,,,,,,,,,,,,,,Wolfgang Neff,,,,,,,,,,,,,,
Hochstapler wider Willen,https://www.filmportal.de/film/hochstapler-wider-willen_2e424e3b58e644539c74a43498f0c950,Spielfilm,1924,Deutschland,,,"Otto Voelckers, Peter Rochelsberg",,"Ellen Kürty, Olga Gsovskaja, Toni Tetzlaff, Ferdinand Martini",,,,Robert Liebmann,,,,,"Ewald Daub, Franz Bertl Seyr",,,,,,,,,,,,,Géza von Bolváry,,,,,,,,,,,,,,
Höhenfieber,https://www.filmportal.de/film/hoehenfieber_23d5dba688ca472abd2f904e905ded6f,Spielfilm,1924,Deutschland,,,Carl Ludwig Kirmse,,"Sascha Gura, Hanni Reinwald, Robert Scholz, Erich Kaiser-Titz, Bengt Aage, Björn Hvid",,,,"Ada van Roon, Gernot Bock-Stieber",,,,,"Hans Bloch, Georg Siebert",,,,,,,,,,,,,Gernot Bock-Stieber,,,,,,,,,,,,,,
Hyänen der Nacht,https://www.filmportal.de/film/hyaenen-der-nacht_bd36f137e7bc4181a842045b6fde7b65,Spielfilm,1924,Deutschland,,,,,,,,,,,,,,,,,,,,,,,,,,,,,,,,,,,,,,,,,
Ich hatt' einen Kameraden,https://www.filmportal.de/film/ich-hatt-einen-kameraden_a5f6a0e26f624361ae5210de49d38d5b,Spielfilm,1924,Deutschland,,,,,"Otto Gebühr, Peter Berneis, Charlotte Klinder, Gertrud Eysoldt",,,,Hans Behrendt,,,,,,,,,,,,,,,Otto Gebühr-Film Gmb: H (Berlin),,,Hans Behrendt,,,,,,,,,,,,,,
Ihr Weg zum Erfolg,https://www.filmportal.de/film/ihr-weg-zum-erfolg_56ce09598c9b4739a7cbb4c5fa7882bc,Spielfilm,1924,Deutschland,,,,,,,,,,,,,,,,,,,,,,,,,,,Felix Basch,,,,,,,,,,,"35mm, 1:1.33",,,
Ihre letzte Dummheit,https://www.filmportal.de/film/ihre-letzte-dummheit_55345f9291e946f2b7b9a5a7d48b66bc,Spielfilm,1924,Deutschland,,,Karl Machus,,"Hella Moja, Harry Hardt, Fritz Greiner, Hans Sternberg, Hugo Werner-Kahle, Rudolf Hoch",,,,Richard Arvay,,,,,Willy Goldberger,,,,,,,,,,,,,Richard Arvay,,,,,,,,,,,,,,
Im Schatten der Anderen,https://www.filmportal.de/film/im-schatten-der-anderen_644aa8422b1947998a2f9b1e467d56d3,Spielfilm,1924,Deutschland,,,,,"Hermann Stäbner, Magda Madeleine, Jo Conradi, Ernst Rückert, Carl Grünwald, Marga Köhler",,,,Robert Heymann,,,,,,,,,,,,,,,,,,Paul von Woringen,,,,,,,,,,"4 Akte, 1268 m","35mm, 1:1.33","s/w, stumm",,
In den Krallen der Schuld,https://www.filmportal.de/film/in-den-krallen-der-schuld_b386b7f8a82346aeac7636139dbf5f79,Spielfilm,1924,Deutschland,,,W. Moldenhauer,,"Eduard von Winterstein: Schlossermeister Witt, Frida Richardseine Frau, Ulrich Bettac: Karl, ihr Sohn, Eduard Rothauser: Kommerzienrat Lynge, Camilla Spira: Matia, seine Tochter, Cleo d'Osterode""Tante"" Jule, Fritz Kampers: Schlossergehilfe, Hermann Picha: Ortsvorsteher",,,,,,,,,Wilhelm Kiermeier,,,,,,,,,,,,,Fred Rommer,,,,,,,,,,,,,,
Kaddisch,https://www.filmportal.de/film/kaddisch_1b46a7ec1d8a47168b5b825931278114,Spielfilm,1924,Deutschland,,,"Walter Röhrig, Robert Herlth",,"Adolf Edgar Licho, Lia Eibenschütz, Ilka Grüning, Rudolf Lettinger, Lucie Höflich, Erna Dehnhardt, Carlos Zizold, Manfred Laske, Emil Heyse, Agnes Müller, Rudolf Hofbauer",,,,Alfred Fekete,,,,,"Willibald Gaebel (Atelier), Paul Lieberenz (Außenaufnahmen)",,,,,,,,,,Licho-Film Gmb: H (Berlin),,,Adolf Edgar Licho,,,,,,,,,,,"35mm, 1:1,33",s/w,,
Der Klabautermann,https://www.filmportal.de/film/der-klabautermann_6b0a18a7058241e79a384fdce23fed5f,Spielfilm,1924,Deutschland,,,Botho Höfer,,"Evi Eva: Marja, Wilhelm Diegelmann: William Russell, Harry Hardt: Holger, sein Neffe, Kläre Grieger: Daisy, seine Tochter, Ludwig Andersen: Kapitän Leeds, Rolf Jäger: François Duval, Hans Trautner: Dr. Fred Maclin",,,,Julius Sternheim,,,,,"Guido Seeber, Reimar Kuntze",,,,,,,,,,Sternheim-Film Gmb: H (Berlin),,,Paul Merzbach,,,,,,,,,National-Film AG (Berlin),,,,,
Die Kleine aus der Konfektion. Großstadtkavaliere,https://www.filmportal.de/film/die-kleine-aus-der-konfektion-grossstadtkavaliere_4c96a444747948deb53179f09bb7da86,Spielfilm,1924,Deutschland,,,Alfred Junge,,"Reinhold Schünzel, Evi Eva, Lilly Flohr, Olga Engl, Margarete Kupfer, Claire Rommer, Anna von Palen, Julia Serda, Karl Beckersachs, Hans Junkermann, Gerhard Ritterband, Karl Harbacher, Siegfried Berisch, Henri Peters-Arnolds",,,,Ruth Goetz,,,,,Kurt Lande,,,,,,Hansheinrich Dransmann (Kino-Musik),,,,,,,Wolfgang Neff,,,,,,,,,,"7 Akte, 2141 m","35mm, 1:1.33","s/w, stumm",,
Der kleine Herzog,https://www.filmportal.de/film/der-kleine-herzog_1488f745aec74c448722e8dfcbcc72f9,Spielfilm,1924,Deutschland,,,,,"Carl Wallauer: Herzog Milan, Robert Scholz: Erbprinz Boris, Maria Fein: Fürstin Katharina, Lia Eibenschütz: Gräfin Helena, Eduard von Winterstein: Oberst v. Trucschicz, Hedwig Pauly-Wintersteinseine Frau, Dora Friese: Irma, seine Frau, Kurt Vespermann: Leutnant Alexander, Olga Limburg: Frl. v. Jonescu, Paul Biensfeldt: Kammerherr v. Kruczicz, Hanspeter Peterhansder kleine Graf Peter, Hermann Picha: Hofmeister",,,,Toni Dathe,,,,,Paul Holzki,,,,,,,,,,,,,Rudolf Walther-Fein,,,,,,,,,,,,,,
Königsliebchen,https://www.filmportal.de/film/koenigsliebchen_59ee2d7ccd054a08b70f8ff0015815b3,Spielfilm,1924,Deutschland,,,"Hermann Warm, Gustav A. Knauer",,"Elisabeth Pinajeff, Bruno Kastner, Robert Scholz, Hans Junkermann, Julia Serda, Erich Kaiser-Titz, Sophie Pagay, Paula Eberty, Philipp Manning, Lantelme Durrer, Hermann Picha, Lydia Potechina, Hermann Vallentin, Hugo Döblin, Luigi Serventi, Joseph Klein, W. Falk",,,,,,,,,Otto Kanturek,,,,,,,,,,,,,Heinz Schall,,,,,,,,,,,,,,
Komödianten des Lebens,https://www.filmportal.de/film/komoedianten-des-lebens_b0c693e9c31a426e983e5092c9131814,Spielfilm,1924,Deutschland,,,Ludwig Kainer,,"Georg Alexander: Detektiv Bobb Doddini, Bruno Kastner: Grenzoffizier, Elga Brink: Elga, Edith Meller: Ly, Lona Schmidt: Lona, Paul Otto: Professor Labori, Willy Schröder: Bastian, Diener, Martin Herzberg: Fred, Elgas Bruder, Bob-Roy: Grenzoffizier",,,,"Robert Liebmann, Hanns Kräly",,,,,Curt Courant,,Ludwig Kainer,,,,,,,,Georg Jacoby-Film Gmb: H (Berlin),,,Georg Jacoby,,,,,,,,,,,"35mm, 1:1,33","s/w, stumm",,
Komödie des Herzens,https://www.filmportal.de/film/komoedie-des-herzens_8e22ff3e176745de9a72f36f7ef0896a,Spielfilm,1924,Deutschland,,,"Robert Herlth, Walter Röhrig",,"Lil Dagover: Gerda Werska, eine gefeierte Tänzerin, Nigel Barrie: Baron Vinzenz, ihr  Freund, Alexander Murski: Graf Inger auf Ingersholm, Ruth Weyher: Inge, seine Tochter, Colette Brettel: Daisy, seine Tochter, Victor Palfi: Jürgen, sein Sohn, Ernst Winar: Knud, Liebhaber der Theatertruppe, Hans Cürlis: Herr Fips, der  Hauslehrer der gräflichen Kinder, Lydia Potechina: Frau Ring, Haushälterin bei  Mme Werska, William Huch, Robert Leffler",,,,"F. W. Murnau, Rochus Gliese",,,,,Theodor Sparkuhl,,,,,,Giuseppe Becce (Bei der Uraufführung),,,,Universum-Film AG (UFA) (Berlin),,,Rochus Gliese,,,,,,,,"Sophie Hoechstetter (Novelle ""Maskenball des Herzens"" (1922))",,"1866 m, 68 min","35mm, 1:1,33","s/w, stumm",,
Das Kreuz am Teufelsgrat,https://www.filmportal.de/film/das-kreuz-am-teufelsgrat_48740a9414bc4b1eb67119b7aa0f17a4,Spielfilm,1924,Deutschland,,,,,,,,,,,,,,,,,,,,,,,,,,,,,,,,,,,,,,,,,
Kronprinz Rudolf und die Tragödie von Mayerling,https://www.filmportal.de/film/kronprinz-rudolf-und-die-tragoedie-von-mayerling_ff068be2f55f4b0ea541cf1b51a8add3,Spielfilm,1924,Deutschland,,,,,,,,,,,,,,,,,,,,,,,,,,,,,,,,,,,,,,,,,
Der letzte Mann,https://www.filmportal.de/film/der-letzte-mann_354d606172df4e89aee14c93fa47a89a,Spielfilm,1924,Deutschland,,,"Robert Herlth, Walter Röhrig, Edgar G. Ulmer (Assistenz)",,"Emil Jannings: Hotelportier, Maly Delschaft: Seine Nichte, Max W. Hiller: Deren Bräutigam, Emilie Kurz: Tante des Bräutigams, Hans Unterkircher: Hotelgeschäftsführer, Olaf Storm: Junger Hotelgast, Hermann Vallentin: Spitzbäuchiger Gast, Georg John: Nachtwächter, Emmy Wyda: Hagere Nachbarin, Erich Schönfelder, Neumann-Schüler, O. E. Hasse",,,,Carl Mayer,UFA-Filmverleih Gmb: H (Berlin),,,,Karl Freund,Robert Baberske,,,,Waldemar Jabs,"Giuseppe Becce (Bei der Uraufführung), Peter Schirmann (1964), Werner Schmidt-Boelcke (1984), Detlev Glanert (Digitalisierte Fassung (Bearbeitung und Ergänzung der Uraufführungs-Version))",,,,Union-Film der Universum-Film AG (Ufa) (Berlin),,Erich Pommer,F. W. Murnau,,,,,Hans Natge,,,,,"6 Akte, 2315 m","35mm, 1:1,33","s/w, stumm",,
Die Liebe ist der Frauen Macht. Kabale und Liebe im Zirkus,https://www.filmportal.de/film/die-liebe-ist-der-frauen-macht-kabale-und-liebe-im-zirkus_6e53c839073b4c62b04c10e8493ed413,Spielfilm,1924,Deutschland,,,"Bernhard Schwidewski, Oskar Friedrich Werndorff",,"Fern Andra: Fern, Wolfgang von Schwindt: Albany, Zirkusdirektor, ihr Vater, Henri Peters-Arnolds: Ralph, Kunstreiter, Fred Immler: Orlando, Kunstschütze, Martin Wolfgang: Bobby, Clown, Renée Blue: Renée, seine Tochter, Livio C. Pavanelli: Mackenzy, ein reicher Ausländer, Paul Rehkopf: Barthou, sein Faktotum, Paul Günther: Untersuchungsrichter, Karl Harbacher: Gerichtsschreiber",,,,Willy Rath,,,,,"Ivar Petersen, Toni Mülleneisen",,,,,,,,,,Fern Andra-Film-Co. Georg Bluen (Berlin),,Georg Bluen,"Erich Engel, Georg Bluen",,,,,,,,,,"6 Akte, 2278 m",,"s/w, stumm",,
Die Liebesbriefe der Baronin von S...,https://www.filmportal.de/film/die-liebesbriefe-der-baronin-von-s_0c34ecd1535b4f648c716b75ab5ca791,Spielfilm,1924,Deutschland,,,Paul Leni,,"Mia May: Baronin von S., Alfredo Bertone: Baron von S., Memo Benassi: Straßenmusikant Giovanni, Desdemona Mazza: Kokotte Jou-Jou - Ginetta, Ernst Gronau: Marquis Grillon",,,,"Paul Reno, Henrik Galeen",,,,,"Frederik Fuglsang, Ludwig Lippert, Giovanni Vitrotti",,,,,,Eduard Prasch (Bei der Uraufführung),,,,May-Film AG (Berlin),,Joe May,Henrik Galeen,,,,,,,,,Universum-Film AG (UFA) (Berlin),"6 Akte, 2381 m","35mm, 1:1,33",s/w,,
Die Liebesbriefe einer Verlassenen,https://www.filmportal.de/film/die-liebesbriefe-einer-verlassenen_ec62f4895f5d49d6b811f692a5dceb66,Spielfilm,1924,Deutschland,,,Carl Ludwig Kirmse,,"Ilka Grüning, Margarete Kupfer, Dora Bergner, Peggy Permont, Heinrich Schroth, Ernst Hofmann, Charles Willy Kayser, Fritz Kampers, Rudolf Klein-Rohden, Robert Leffler",,,,,,,,,Kurt Lande,,,,,,,,,,,,,Emmerich Hanus,,,,,,,,,,,,,,
Liebet das Leben,https://www.filmportal.de/film/liebet-das-leben_d0bbce37c57b4cd98db5735cffbf1eab,Spielfilm,1924,Deutschland,,,Willy Reiber,,"Georg Heinrich Schnell: Thomas Brey, Olga Gsovskaja: Allan, dessen Nichte, Helena Makowska: Lucienne d’Or, Harry Reve: Boxer Harry",,,,Georg Asagaroff,,,,,"Franz Koch, Wilhelm Kiermeier",,Leo Pasetti,,,,,,,,,,,Georg Asagaroff,,,,,,,,,,,,,,
Die lockende Gefahr,https://www.filmportal.de/film/die-lockende-gefahr_78f91c7e30fb4f469167512e5b132017,Spielfilm,1924,Deutschland,,,Bernhard Schwidewski,,"Simone Vaudry, Eugenie Otzoup, Margarete Kupfer, Frida Richard, Paul Menant, Curt Doerry, Hermann Picha, Karl Victor Plagge, Karl Harbacher, Adolf Klein",,,,Franz Schulz,,,,,Gustave Preiß,,,,,,,,,,Progreß-Film Gmb: H (Berlin),,,Josef Stein,,,,,,,,,,,,,,
Lord Reginalds Derbyritt,https://www.filmportal.de/film/lord-reginalds-derbyritt_f9b8a8d43d234bf5ab5ded6476be0012,Spielfilm,1924,Deutschland,,,Julian Ballenstedt,,"Ernst Hofmann, Uschi Elleot, Jutta Jol, Ralph Arthur Roberts, Karl Platen, Rudolf Klein-Rohden, Wilhelm Kaiser-Heyl, Fritz Kampers",,,,Paul Günther,,,,,Heinrich Gärtner,,,,,,,,,,,,,Arthur Teuber,,,,,,,,,,,,,,
Die Luftfahrt über den Ozean. Haralds kühnstes Abenteuer,https://www.filmportal.de/film/die-luftfahrt-ueber-den-ozean-haralds-kuehnstes-abenteuer_265332ebd5ef4953a5f9ab7c5445aea5,Spielfilm,1924,Deutschland,,,,,"Alf Blütecher, Barbara von Annenkoff, Christian Bummerstedt",,,,,,,,,,,,,,,,,,,,,,Wolfgang Neff,,,,,,,,,,,,,,
Lumpen und Seide,https://www.filmportal.de/film/lumpen-und-seide_b0cb9528c1a64fe987291c205b1fab37,Spielfilm,1924,Deutschland,,,Kurt Richter,,"Reinhold Schünzel: Max, Mary Parker: Irene, Johannes Riemann: Erik, ihr Mann, Einar Hanson: Werner, sein Bruder, Maly Delschaft: Ulrike, Gesellschafterin, Mary Kid: Hilde, ein Mädchen aus dem Volke, Ferdinand Bonn: Hildes Vater",,,,"Adolf Lantz, Heinz Goldberg",,,,,"Mutz Greenbaum, Emil Schünemann",,,,Artur Rebner,,"Hugo Hirsch (Titelsong  ""Shimmy"")",,,,Richard Oswald-Film AG (Berlin),,,Richard Oswald,,,,,,,,,,96,"35mm, 1:1,33","s/w, stumm",,
Das Mädchen aus dem Kaufhaus,https://www.filmportal.de/film/das-maedchen-aus-dem-kaufhaus_23c3606383084f4d9d1e402497a61a9c,Spielfilm,1924,Deutschland,,,,,,,,,,,,,,,,,,,,,,,,,,,,,,,,,,,,,"5 Akte, 1358 m","35mm, 1:1.33","s/w, stumm",,
"Mädchen, die man nicht heiratet",https://www.filmportal.de/film/maedchen-die-man-nicht-heiratet_07e955d1cb454e0ca3cc5ea791fabd06,Spielfilm,1924,Deutschland,,,,,"Ellen Kürty: Das Mädchen, das man nicht heiratet, Karl Beckersachs: Der Ladenprinz, Paul Otto: Der Schiebergraf, Hans Mierendorff: Er, Peter Arnolds: Der junge Mann aus guter Familie, Ellen Kürlidas Mädchen, das man nicht heiratet, Henri Peters-Arnoldsder junge Mann aus guter Familie, Clementine Plessner, Ernestine Costa, Ellen Heel, Grete Hollmann, Margarete Kupfer, Helene von Bolváry, Albert Steinrück, Fred Köster, Großmann, Georg Heinrich, Walter Lantzsch, August Wisbeck",,,,Margarete M. Langen,,,,,,,,,,,,,,,,,,Géza von Bolváry,,,,,,,,,,"5 Akte, 1804 m",,"s/w, stumm",,
Das Mädel von Capri,https://www.filmportal.de/film/das-maedel-von-capri_f66f8be6b3684679a55e84f15be36791,Spielfilm,1924,Deutschland,,,"Hans Sohnle, Otto Erdmann",,"Lya Mara, Ulrich Bettac, Robert Scholz, Hermann Böttcher, Julia Serda, Ernst Dernburg",,,,,,,,,"Mutz Greenbaum, Gustave Preiß",,,,,,,,,,Zelnik-Mara-Film Gmb: H (Berlin),,,Friedrich Zelnik,,,,,,,,,,,,,,
Das Mädel von Pontecuculi,https://www.filmportal.de/film/das-maedel-von-pontecuculi_eff2906f5bc54b60922f9390f479484d,Spielfilm,1924,Deutschland,,,,,"Ada Svedin: Pipsi, Tochter des Bürgermeisters, Charles Willy Kayser: Carlo XVII., Fürst von Ponteredo / Octav d’Olbert,, Hermann Böttcher: Graf Dodo Caramba Formanoli, Hofmarschall, Emil Stammer: Nicodemus Carnero, Bürgermeister, Rudi Oehler: Bonaventura Baldrian, Komiker, Ellen Isenta: Innozencia Primarose, Schauspielerin",,,,O. A. Witte,,,,,Emil Schünemann,,,,,,Hans Ailbout (Kino-Musik),,Richard Schönian,,,,,Ludwig Czerny,,,,,,,,,,,,,,
Die malayische Dschonke,https://www.filmportal.de/film/die-malayische-dschonke_e9874547dba7498ca49adcbd8fb6f1b0,Spielfilm,1924,Deutschland,,,Max Heilbronner,,"Ernst Reicher: Stuart Webbs, Alexandra Sorina, Arnold Marlé, Magda Simon, Ernst Bosser, Claire Kronburger, Jack Mylong-Münz",,,,,,,,,Alfons Brümmer,,,,,,,,,,,,,Max Obal,,,,,,,,,,,,,,
Malva,https://www.filmportal.de/film/malva_c9e16faf666a4944b0488e7ab131f05b,Spielfilm,1924,Deutschland,,,Willi A. Herrmann,,"Lya de Putti: Malva, Ernst Rückert: Tassilo, Leutnant der Grenz-Gendarmen, Tronier Funder: Bosco, Sergeant, Hans Adalbert Schlettow: Tadzio, Erich Kaiser-Titz: Grigori",,,,"Rolf E. Vanloo, Robert Dinesen",,,,,Julius Balting,,,,,,,,,,Phoebus-Film AG (Berlin),,,Robert Dinesen,,,,,,,,,,,"35mm, 1:1,33","s/w, Ohne Ton",,
Der Mann ohne Nerven,https://www.filmportal.de/film/der-mann-ohne-nerven_632eae576a25418b81c7fccdc7d1e408,Spielfilm,1924,Deutschland/Frankreich,,,Fritz Kraencke,,"Harry Piel: Der Mann ohne Nerven, Albert Paulig: Henry Ricold, Direktor des Ikarus Verlages, Marguerite Madys: Yvette, seine Frau, Paul GuidéHector Marcel, Herzog de Frontignac-Epinay, Dary Holm: Aud Egede Christensen, Denise Legeay: Lizzie, José Davert: Jack Brown, Hermann Picha: Der Notar des Herzogs",,,,"Edmund Heuberger, Herbert Nossen, Harry Piel",,,,,"Georg Muschner, Gotthardt Wolf",,,,,,,,,,Hape-Film Co. Gmb: H (Berlin),,"Harry Piel, Heinrich Nebenzahl","Harry Piel, Gérard Bourgeois",Gérard Bourgeois,,,,,,,,,,,,,
Der Mann um Mitternacht,https://www.filmportal.de/film/der-mann-um-mitternacht_e35f6860bf6c4ecf88a83981151932df,Spielfilm,1924,Deutschland,,,Alfred Junge,,"Hella Moja, Olaf Fjord, Henrik Malberg, Holger-Madsen, Karl Etlinger, Claire Rommer, Erling Hanson, Adolphe Engers, Claus Hemmersbach",,,,"Marie-Louise Droop, Holger-Madsen",,,,,Willy Goldberger,,,,,,,,,,,,,Holger-Madsen,,,,,,,,,,,,,,
